{
  "schema": "skepvox--demos-note",
  "schemaVersion": 1,
  "source": {
    "path": "src/demos/casos/cpmi-do-inss.md",
    "sha256": "0eb41a41ea390a08bc9e525915be72c0bdcb02c5f6e6288423941f731d095f6d"
  },
  "id": "case--cpmi-do-inss",
  "type": "case",
  "url": "/demos/casos/cpmi-do-inss",
  "title": "CPMI do INSS",
  "description": "Linha do tempo e fontes públicas sobre a CPMI do INSS (Congresso/Senado), criada para apurar descontos não autorizados em benefícios.",
  "updatedAt": "2026-01-12",
  "demos": {
    "id": "case--cpmi-do-inss",
    "type": "case",
    "mapLabel": "cpmi-inss",
    "seed": "no",
    "seed-id": "person--luiz-inacio-lula-da-silva",
    "target-questions": [
      "q--person--antonio-carlos-camilo-antunes--001",
      "q--person--fabio-luis-lula-da-silva--001"
    ],
    "country": "BR",
    "aliases": [
      "CPMI do INSS",
      "Comissão Parlamentar Mista de Inquérito do INSS",
      "Fraudes no INSS (CPMI)",
      "Descontos indevidos no INSS (CPMI)",
      "Descontos associativos no INSS (CPMI)"
    ],
    "tags": [
      "previdencia",
      "inss",
      "cpmi",
      "senado"
    ]
  },
  "frontmatter": {
    "title": "CPMI do INSS",
    "description": "Linha do tempo e fontes públicas sobre a CPMI do INSS (Congresso/Senado), criada para apurar descontos não autorizados em benefícios.",
    "demos": {
      "id": "case--cpmi-do-inss",
      "type": "case",
      "mapLabel": "cpmi-inss",
      "seed": "no",
      "seed-id": "person--luiz-inacio-lula-da-silva",
      "target-questions": [
        "q--person--antonio-carlos-camilo-antunes--001",
        "q--person--fabio-luis-lula-da-silva--001"
      ],
      "country": "BR",
      "aliases": [
        "CPMI do INSS",
        "Comissão Parlamentar Mista de Inquérito do INSS",
        "Fraudes no INSS (CPMI)",
        "Descontos indevidos no INSS (CPMI)",
        "Descontos associativos no INSS (CPMI)"
      ],
      "tags": [
        "previdencia",
        "inss",
        "cpmi",
        "senado"
      ]
    }
  },
  "frontmatterYaml": "title: \"CPMI do INSS\"\ndescription: \"Linha do tempo e fontes públicas sobre a CPMI do INSS (Congresso/Senado), criada para apurar descontos não autorizados em benefícios.\"\ndemos:\n  id: case--cpmi-do-inss\n  type: case\n  mapLabel: cpmi-inss\n  seed: no\n  seed-id: person--luiz-inacio-lula-da-silva\n  target-questions:\n    - q--person--antonio-carlos-camilo-antunes--001\n    - q--person--fabio-luis-lula-da-silva--001\n  country: BR\n  aliases:\n    - CPMI do INSS\n    - Comissão Parlamentar Mista de Inquérito do INSS\n    - Fraudes no INSS (CPMI)\n    - Descontos indevidos no INSS (CPMI)\n    - Descontos associativos no INSS (CPMI)\n  tags:\n    - previdencia\n    - inss\n    - cpmi\n    - senado",
  "bodyMarkdown": "# CPMI do INSS\n\n::: info Nota editorial (Skepvox)\nEsta página descreve a **CPMI do INSS** (Congresso/Senado) como instrumento de investigação parlamentar,\ncom foco em **cronologia**, **status** e **fontes públicas**. Alegações aparecem como alegações (“segundo cobertura”).\n:::\n\n_Última atualização: 2026-01-12. ID Skepvox: `case--cpmi-do-inss`._\n\n<DemosEntityMap />\n\n## Situação atual\n\n- Status (alto nível): a CPMI do INSS foi criada em agosto de 2025 e tem funcionamento previsto até março de 2026, segundo notícia institucional do Senado. Fonte: [Agência Senado (2025-09-25)](https://www12.senado.leg.br/noticias/materias/2025/09/25/careca-do-inss-se-compromete-a-enviar-documentos-de-empresas-a-cpmi).\n- Fontes primárias (Senado): é possível auditar colegiado, reuniões, documentos e notas taquigráficas via Dados Abertos do Senado (ex.: colegiado `2794`). Fonte: [Senado (Dados Abertos)](https://legis.senado.leg.br/dadosabertos/comissao/2794).\n- Atividade registrada: em 2025-09-25, [Antônio Carlos Camilo Antunes](/demos/pessoas/antonio-carlos-camilo-antunes) depôs à CPMI, segundo notícia institucional. Fonte: [Agência Senado (2025-09-25)](https://www12.senado.leg.br/noticias/materias/2025/09/25/careca-do-inss-se-compromete-a-enviar-documentos-de-empresas-a-cpmi).\n- Nomes citados (cautela): [Fábio Luís Lula da Silva](/demos/pessoas/fabio-luis-lula-da-silva) é citado em cobertura no contexto da CPMI; a BBC registra que ele “não é investigado no caso” na data do texto. Fonte: [BBC (2025-12-04)](https://www.bbc.com/portuguese/articles/cj69rj80g00o).\n\n## Por que está no mapa\n\n- Conexão de origem: rede inicial de [Luiz Inácio Lula da Silva](/demos/pessoas/luiz-inacio-lula-da-silva), via menções em cobertura e registro institucional de atividades da CPMI no caso. Fontes: [Agência Senado (2025-09-25)](https://www12.senado.leg.br/noticias/materias/2025/09/25/careca-do-inss-se-compromete-a-enviar-documentos-de-empresas-a-cpmi), [BBC (2025-12-04)](https://www.bbc.com/portuguese/articles/cj69rj80g00o).\n- Perguntas-alvo (rastreamento): `q--person--antonio-carlos-camilo-antunes--001`; `q--person--fabio-luis-lula-da-silva--001`.\n- Evidência mínima: há registro institucional do Senado sobre a CPMI, incluindo oitiva de depoente e escopo relacionado a descontos não autorizados em benefícios do INSS. Fonte: [Agência Senado (2025-09-25)](https://www12.senado.leg.br/noticias/materias/2025/09/25/careca-do-inss-se-compromete-a-enviar-documentos-de-empresas-a-cpmi).\n- Fontes-alvo (próximos passos): atas, requerimentos e transcrições públicas da CPMI; documentos disponibilizados oficialmente; relatório final (quando houver) e encaminhamentos formais.\n\n## Perguntas abertas (hipóteses)\n\n- `q--case--cpmi-do-inss--001`\n  - Pergunta: quais requerimentos, oitivas, documentos recebidos e relatórios da CPMI do INSS estão publicamente acessíveis, e como eles se conectam a peças/decisões públicas da investigação (PF/CGU)?\n  - Estado: `em-apuracao`.\n  - Hipótese: existe documentação pública suficiente (atas, requerimentos e transcrições) para mapear, com rastreabilidade, o que foi alegado e quais foram os encaminhamentos formais da CPMI.\n  - Contra‑hipótese: parte relevante permanece sem publicização (ou em formatos difíceis de auditar), e a CPMI gera mais sinal político do que evidência documental rastreável.\n  - Próximos passos: inventariar (com IDs) reuniões, requerimentos, documentos e notas taquigráficas via Dados Abertos; registrar o que é público vs. não publicado; cruzar peças parlamentares com peças/decisões públicas da investigação (PF/CGU).\n  - Notas que avançam: [Operação Sem Desconto (PF/CGU)](/demos/casos/operacao-sem-desconto).\n\n## Fontes primárias (Senado / Dados Abertos)\n\nEsta seção serve como “índice operacional” para localizar documentos e reuniões da CPMI do INSS em fontes públicas primárias.\n\n### Colegiado (código `2794`)\n\n- Detalhes do colegiado (CPMI - INSS): https://legis.senado.leg.br/dadosabertos/comissao/2794\n\n### Documentos apresentados (Processo → Documento)\n\nO endpoint recomendado (sucessor de `/comissao/.../documentos`) permite filtrar documentos por colegiado, mas restringe o período por requisição:\n\n- https://legis.senado.leg.br/dadosabertos/processo/documento?codigoColegiado=2794&dataInicio=2025-08-01&dataFim=2026-01-12\n\nNota: a API limita o período a **6 meses** por consulta; para cobrir todo o intervalo, usar janelas sequenciais.\n\n### Agenda e reuniões\n\n- Agenda por data (`AAAAMMDD`): https://legis.senado.leg.br/dadosabertos/comissao/agenda/20250925\n- A agenda retorna o `codigo` (ID) da reunião, que pode ser usado para buscar o detalhe.\n\n### Detalhe da reunião (pauta, ata, resultado, vídeo)\n\n- Detalhe de reunião (exemplo `13989`): https://legis.senado.leg.br/dadosabertos/comissao/reuniao/13989\n- O detalhe pode incluir links diretos para PDFs publicados (pauta simples/cheia, ata, resultado) via `sdleg-getter/documento/download/<uuid>` e, quando aplicável, link para ECidadania.\n\n### Notas taquigráficas (texto + áudio)\n\n- Notas taquigráficas por reunião (exemplo `13989`): https://legis.senado.leg.br/dadosabertos/taquigrafia/notas/reuniao/13989\n\n### Exemplo (25/09/2025 — reunião `13989`)\n\n- Agenda (descobrir o ID): https://legis.senado.leg.br/dadosabertos/comissao/agenda/20250925\n- Detalhe (pauta/ata/resultado + links): https://legis.senado.leg.br/dadosabertos/comissao/reuniao/13989\n- Notas taquigráficas (texto + áudio): https://legis.senado.leg.br/dadosabertos/taquigrafia/notas/reuniao/13989\n\n## Linha do tempo\n\n- 2025-08 — Notícia institucional do Senado registra que a CPMI do INSS foi criada no “último mês de agosto”. Status: `documented`. Fonte: [Agência Senado (2025-09-25)](https://www12.senado.leg.br/noticias/materias/2025/09/25/careca-do-inss-se-compromete-a-enviar-documentos-de-empresas-a-cpmi).\n- 2025-09-25 — [Antônio Carlos Camilo Antunes](/demos/pessoas/antonio-carlos-camilo-antunes) depõe à CPMI do INSS e declara inocência, segundo notícia institucional. Status: `documented`. Fonte: [Agência Senado (2025-09-25)](https://www12.senado.leg.br/noticias/materias/2025/09/25/careca-do-inss-se-compromete-a-enviar-documentos-de-empresas-a-cpmi).\n- 2025-12-04 — Reportagem descreve disputas e alegações envolvendo o nome de [Fábio Luís Lula da Silva](/demos/pessoas/fabio-luis-lula-da-silva) no contexto da CPMI, e registra que ele não é investigado (na data do texto). Status: `reported`. Fonte: [BBC (2025-12-04)](https://www.bbc.com/portuguese/articles/cj69rj80g00o).\n\n## Pessoas relacionadas\n\n- [Antônio Carlos Camilo Antunes](/demos/pessoas/antonio-carlos-camilo-antunes) — depoente citado em notícia institucional da CPMI do INSS. Fonte: [Agência Senado (2025-09-25)](https://www12.senado.leg.br/noticias/materias/2025/09/25/careca-do-inss-se-compromete-a-enviar-documentos-de-empresas-a-cpmi).\n- [Fábio Luís Lula da Silva](/demos/pessoas/fabio-luis-lula-da-silva) — citado em cobertura jornalística no contexto da CPMI do INSS; reportagem registra que ele não é investigado no caso (na data do texto). Fonte: [BBC (2025-12-04)](https://www.bbc.com/portuguese/articles/cj69rj80g00o).\n\n## Organizações relacionadas\n\n- Instituições citadas nas fontes (sem página ainda no Skepvox): Senado Federal; CPMI do INSS; Instituto Nacional do Seguro Social (INSS).\n\n## Casos relacionados\n\n- [Operação Sem Desconto (PF/CGU)](/demos/casos/operacao-sem-desconto)\n\n## Fontes\n\n- Senado Notícias — “‘Careca do INSS’ se compromete a enviar documentos de empresas à CPMI” (acesso em 2026-01-12): https://www12.senado.leg.br/noticias/materias/2025/09/25/careca-do-inss-se-compromete-a-enviar-documentos-de-empresas-a-cpmi\n- BBC News Brasil — “Amiga de Lulinha na mira da PF: o que se sabe…” (acesso em 2026-01-12): https://www.bbc.com/portuguese/articles/cj69rj80g00o\n- Senado (Dados Abertos) — Detalhes do colegiado `2794` (acesso em 2026-01-12): https://legis.senado.leg.br/dadosabertos/comissao/2794\n- Senado (Dados Abertos) — Agenda de reuniões (2025-09-25) (acesso em 2026-01-12): https://legis.senado.leg.br/dadosabertos/comissao/agenda/20250925\n- Senado (Dados Abertos) — Detalhe da reunião `13989` (acesso em 2026-01-12): https://legis.senado.leg.br/dadosabertos/comissao/reuniao/13989\n- Senado (Dados Abertos) — Notas taquigráficas (reunião `13989`) (acesso em 2026-01-12): https://legis.senado.leg.br/dadosabertos/taquigrafia/notas/reuniao/13989\n- Senado (Dados Abertos) — Documentos por colegiado (Processo → Documento; `codigoColegiado=2794`) (acesso em 2026-01-12): https://legis.senado.leg.br/dadosabertos/processo/documento?codigoColegiado=2794&dataInicio=2025-08-01&dataFim=2026-01-12\n",
  "outboundLinks": [
    {
      "text": "Antônio Carlos Camilo Antunes",
      "href": "/demos/pessoas/antonio-carlos-camilo-antunes"
    },
    {
      "text": "Fábio Luís Lula da Silva",
      "href": "/demos/pessoas/fabio-luis-lula-da-silva"
    },
    {
      "text": "Luiz Inácio Lula da Silva",
      "href": "/demos/pessoas/luiz-inacio-lula-da-silva"
    },
    {
      "text": "Operação Sem Desconto (PF/CGU)",
      "href": "/demos/casos/operacao-sem-desconto"
    },
    {
      "text": "Antônio Carlos Camilo Antunes",
      "href": "/demos/pessoas/antonio-carlos-camilo-antunes"
    },
    {
      "text": "Fábio Luís Lula da Silva",
      "href": "/demos/pessoas/fabio-luis-lula-da-silva"
    },
    {
      "text": "Antônio Carlos Camilo Antunes",
      "href": "/demos/pessoas/antonio-carlos-camilo-antunes"
    },
    {
      "text": "Fábio Luís Lula da Silva",
      "href": "/demos/pessoas/fabio-luis-lula-da-silva"
    },
    {
      "text": "Operação Sem Desconto (PF/CGU)",
      "href": "/demos/casos/operacao-sem-desconto"
    }
  ],
  "outboundLinksBySection": [
    {
      "section": "Situação atual",
      "links": [
        {
          "text": "Antônio Carlos Camilo Antunes",
          "href": "/demos/pessoas/antonio-carlos-camilo-antunes"
        },
        {
          "text": "Fábio Luís Lula da Silva",
          "href": "/demos/pessoas/fabio-luis-lula-da-silva"
        }
      ]
    },
    {
      "section": "Por que está no mapa",
      "links": [
        {
          "text": "Luiz Inácio Lula da Silva",
          "href": "/demos/pessoas/luiz-inacio-lula-da-silva"
        }
      ]
    },
    {
      "section": "Perguntas abertas (hipóteses)",
      "links": [
        {
          "text": "Operação Sem Desconto (PF/CGU)",
          "href": "/demos/casos/operacao-sem-desconto"
        }
      ]
    },
    {
      "section": "Linha do tempo",
      "links": [
        {
          "text": "Antônio Carlos Camilo Antunes",
          "href": "/demos/pessoas/antonio-carlos-camilo-antunes"
        },
        {
          "text": "Fábio Luís Lula da Silva",
          "href": "/demos/pessoas/fabio-luis-lula-da-silva"
        }
      ]
    },
    {
      "section": "Pessoas relacionadas",
      "links": [
        {
          "text": "Antônio Carlos Camilo Antunes",
          "href": "/demos/pessoas/antonio-carlos-camilo-antunes"
        },
        {
          "text": "Fábio Luís Lula da Silva",
          "href": "/demos/pessoas/fabio-luis-lula-da-silva"
        }
      ]
    },
    {
      "section": "Casos relacionados",
      "links": [
        {
          "text": "Operação Sem Desconto (PF/CGU)",
          "href": "/demos/casos/operacao-sem-desconto"
        }
      ]
    }
  ],
  "relations": {
    "cases": [
      {
        "text": "Operação Sem Desconto (PF/CGU)",
        "href": "/demos/casos/operacao-sem-desconto"
      }
    ],
    "family": [],
    "people": [
      {
        "text": "Antônio Carlos Camilo Antunes",
        "href": "/demos/pessoas/antonio-carlos-camilo-antunes"
      },
      {
        "text": "Fábio Luís Lula da Silva",
        "href": "/demos/pessoas/fabio-luis-lula-da-silva"
      }
    ],
    "organizations": []
  },
  "relationSectionTitles": {
    "cases": "Casos relacionados",
    "family": null,
    "people": "Pessoas relacionadas",
    "organizations": "Organizações relacionadas"
  },
  "openQuestions": [
    {
      "id": "q--case--cpmi-do-inss--001",
      "question": "quais requerimentos, oitivas, documentos recebidos e relatórios da CPMI do INSS estão publicamente acessíveis, e como eles se conectam a peças/decisões públicas da investigação (PF/CGU)?",
      "state": "em-apuracao",
      "hypothesis": "existe documentação pública suficiente (atas, requerimentos e transcrições) para mapear, com rastreabilidade, o que foi alegado e quais foram os encaminhamentos formais da CPMI.",
      "counterHypothesis": "parte relevante permanece sem publicização (ou em formatos difíceis de auditar), e a CPMI gera mais sinal político do que evidência documental rastreável.",
      "nextSteps": "inventariar (com IDs) reuniões, requerimentos, documentos e notas taquigráficas via Dados Abertos; registrar o que é público vs. não publicado; cruzar peças parlamentares com peças/decisões públicas da investigação (PF/CGU).",
      "advancingNotes": [
        "/demos/casos/operacao-sem-desconto"
      ]
    }
  ]
}
