{
  "schema": "skepvox--demos-note",
  "schemaVersion": 1,
  "source": {
    "path": "src/demos/casos/8-de-janeiro-2023.md",
    "sha256": "7e128b5aa08fa76f5d9ad2d348abe27ed89bea14666ca92ee888bbb70381d688"
  },
  "id": "case--8-de-janeiro-2023",
  "type": "case",
  "url": "/demos/casos/8-de-janeiro-2023",
  "title": "8 de Janeiro de 2023 (Ataques em Brasília)",
  "description": "Linha do tempo e fontes públicas sobre os ataques de 8 de janeiro de 2023 em Brasília e seus desdobramentos.",
  "updatedAt": "2026-01-10",
  "demos": {
    "id": "case--8-de-janeiro-2023",
    "type": "case",
    "mapLabel": "8-jan",
    "seed": "yes",
    "seed-id": "case--8-de-janeiro-2023",
    "country": "BR",
    "aliases": [
      "8 de janeiro",
      "8/1",
      "Atos de 8 de janeiro",
      "Ataques de 8 de janeiro"
    ],
    "tags": [
      "democracia",
      "justica",
      "investigacao",
      "brasilia"
    ]
  },
  "frontmatter": {
    "title": "8 de Janeiro de 2023 (Ataques em Brasília)",
    "description": "Linha do tempo e fontes públicas sobre os ataques de 8 de janeiro de 2023 em Brasília e seus desdobramentos.",
    "demos": {
      "id": "case--8-de-janeiro-2023",
      "type": "case",
      "mapLabel": "8-jan",
      "seed": "yes",
      "seed-id": "case--8-de-janeiro-2023",
      "country": "BR",
      "aliases": [
        "8 de janeiro",
        "8/1",
        "Atos de 8 de janeiro",
        "Ataques de 8 de janeiro"
      ],
      "tags": [
        "democracia",
        "justica",
        "investigacao",
        "brasilia"
      ]
    }
  },
  "frontmatterYaml": "title: \"8 de Janeiro de 2023 (Ataques em Brasília)\"\ndescription: \"Linha do tempo e fontes públicas sobre os ataques de 8 de janeiro de 2023 em Brasília e seus desdobramentos.\"\ndemos:\n  id: case--8-de-janeiro-2023\n  type: case\n  mapLabel: 8-jan\n  seed: yes\n  seed-id: case--8-de-janeiro-2023\n  country: BR\n  aliases:\n    - 8 de janeiro\n    - 8/1\n    - Atos de 8 de janeiro\n    - Ataques de 8 de janeiro\n  tags:\n    - democracia\n    - justica\n    - investigacao\n    - brasilia",
  "bodyMarkdown": "# 8 de Janeiro de 2023 (Ataques em Brasília)\n\n::: info Nota editorial (Skepvox)\nEste caso envolve interpretações políticas conflitantes. O objetivo aqui é\norganizar uma cronologia verificável (com fontes) e explicitar hipóteses como\nperguntas testáveis — sem tratar hipótese como fato e sem rótulos.\n:::\n\n_Última atualização: 2026-01-10. ID Skepvox: `case--8-de-janeiro-2023`._\n\n## Situação atual\n\n- Status (alto nível): o STF segue julgando e condenando envolvidos nos atos de 8 de janeiro (em diferentes sessões e turmas), segundo comunicado institucional. Fonte: [STF](https://noticias.stf.jus.br/postsnoticias/stf-condena-mais-119-pessoas-pelos-atos-antidemocraticos-de-8-1/).\n- Responsabilização e controvérsias: persistem disputas públicas sobre “falhas/omissões” na prevenção, cadeia de custódia de evidências (ex.: imagens) e alcance da responsabilização (autoria individual vs. coordenação/financiamento). Fontes de contexto: [Folha](https://www1.folha.uol.com.br/poder/2023/04/veja-integra-dos-alertas-da-abin-ao-gsi-e-ao-ministerio-da-justica-antes-do-81.shtml), [G1](https://g1.globo.com/df/distrito-federal/noticia/2023/01/08/bolsonaristas-radicais-entram-em-confronto-com-a-policia-na-esplanada-e-sobem-rampa-do-congresso-nacional-em-brasilia.ghtml).\n\n## Por que está no mapa\n\n- Conexão de origem: página‑semente (Skepvox).\n- Evidência mínima: em 08-01-2023, grupos invadiram e depredaram o Congresso Nacional, o STF e o Palácio do Planalto em Brasília, após confronto com a polícia na Esplanada, segundo cobertura. Fonte: [G1](https://g1.globo.com/df/distrito-federal/noticia/2023/01/08/bolsonaristas-radicais-entram-em-confronto-com-a-policia-na-esplanada-e-sobem-rampa-do-congresso-nacional-em-brasilia.ghtml).\n- Fontes‑alvo (próximos passos): decisões integrais (STF/TRF/etc.), denúncias e peças públicas; relatórios/auditorias (quando publicados) e documentação de cadeia de custódia (imagens, perícias, logs e anexos).\n\n## Perguntas abertas (hipóteses)\n\n- `q--case--8-de-janeiro-2023--001`\n  - Pergunta: quais alertas prévios existiam (inteligência e segurança), para quem foram enviados, e o que foi feito com eles antes do 08-01?\n  - Estado: `em-apuracao`.\n  - Hipótese: existiam alertas acionáveis e houve falhas/omissões relevantes na resposta preventiva (por ação, inação ou coordenação insuficiente).\n  - Contra-hipótese: os alertas eram genéricos/insuficientes, ou a resposta foi compatível com as informações disponíveis e limitações operacionais.\n  - Próximos passos: coletar íntegra de alertas e encaminhamentos; registros de recebimento e decisões; depoimentos públicos; relatórios de órgãos de controle. Fonte-alvo inicial: [Folha](https://www1.folha.uol.com.br/poder/2023/04/veja-integra-dos-alertas-da-abin-ao-gsi-e-ao-ministerio-da-justica-antes-do-81.shtml).\n  - Notas que avançam: [Flávio Dino](/demos/pessoas/flavio-dino); [Alexandre de Moraes](/demos/pessoas/alexandre-de-moraes).\n- `q--case--8-de-janeiro-2023--002`\n  - Pergunta: a cadeia de custódia de imagens e outros materiais (câmeras/servidores/anexos) é auditável e preservada de ponta a ponta?\n  - Estado: `em-apuracao`.\n  - Hipótese: há lacunas relevantes de preservação/entrega/documentação que prejudicam auditoria pública e judicial do que ocorreu e de quem fez o quê.\n  - Contra-hipótese: a cadeia de custódia é suficientemente documentada (apreensão, cópias forenses, perícias) e as lacunas aparentes têm explicação técnica/administrativa verificável.\n  - Próximos passos: identificar repositórios oficiais, laudos e termos de apreensão; mapear quais conjuntos de imagens existem, quais foram anexados a inquéritos e quais não; checar decisões e perícias citadas publicamente.\n  - Notas que avançam: [Flávio Dino](/demos/pessoas/flavio-dino); [Alexandre de Moraes](/demos/pessoas/alexandre-de-moraes).\n- `q--case--8-de-janeiro-2023--003`\n  - Pergunta: existe evidência pública robusta de infiltração/provocação (por qualquer grupo político, estatal ou não) para escalar vandalismo e/ou produzir pretexto para prisões?\n  - Estado: `aberta`.\n  - Hipótese: houve infiltração/provocação com objetivo de maximizar dano simbólico e influenciar desdobramentos políticos/judiciais.\n  - Contra-hipótese: a explicação mais consistente é a participação voluntária de manifestantes e redes de mobilização já identificadas nas investigações, sem evidência verificável de “false flag”.\n  - Próximos passos: buscar indícios documentais e não apenas inferências; checar se há inquéritos, denúncias ou decisões que tratem especificamente da hipótese; comparar com evidências materiais (vídeos, perícias, identificação).\n  - Notas que avançam: nenhuma ainda.\n- `q--case--8-de-janeiro-2023--004`\n  - Pergunta: qual foi o nível de coordenação e financiamento (logística, transporte, comunicação) e quais atores podem ser responsabilizados por isso?\n  - Estado: `aberta`.\n  - Hipótese: existiu coordenação financiada (rede) com rastros verificáveis (pagamentos, mensagens, logística) além de “autoria individual”.\n  - Contra-hipótese: a mobilização foi majoritariamente difusa, com coordenação limitada e sem um núcleo financiador identificável publicamente.\n  - Próximos passos: mapear decisões e denúncias que tratem de financiamento; buscar dados de quebras de sigilo já publicadas; acompanhar sentenças e votos que descrevam elementos de coordenação.\n  - Notas que avançam: nenhuma ainda.\n\n## Resumo\n\n- 08-01-2023 — Grupos invadem e depredam sedes do Congresso Nacional, do STF e do Palácio do Planalto em Brasília, segundo cobertura. Fonte: [G1](https://g1.globo.com/df/distrito-federal/noticia/2023/01/08/bolsonaristas-radicais-entram-em-confronto-com-a-policia-na-esplanada-e-sobem-rampa-do-congresso-nacional-em-brasilia.ghtml).\n- 09-01-2023 — Moraes afasta o governador do DF por 90 dias, citando “omissão e conivência de diversas autoridades”, segundo reportagem que reproduz trechos da decisão. Fonte: [Folha](https://www1.folha.uol.com.br/poder/2023/01/moraes-afasta-governador-do-df-do-cargo-apos-vandalismo-em-brasilia.shtml).\n- 2023-04-28 — Folha publica a íntegra de alertas da Abin ao GSI e ao Ministério da Justiça antes do 8/1, segundo a própria reportagem. Fonte: [Folha](https://www1.folha.uol.com.br/poder/2023/04/veja-integra-dos-alertas-da-abin-ao-gsi-e-ao-ministerio-da-justica-antes-do-81.shtml).\n- 2024-08-05 — STF informa condenações adicionais de pessoas envolvidas (mais 119, em sessões virtuais listadas), segundo nota institucional. Fonte: [STF](https://noticias.stf.jus.br/postsnoticias/stf-condena-mais-119-pessoas-pelos-atos-antidemocraticos-de-8-1/).\n\n## Linha do tempo\n\n### 2023-01-08 — Ocorrência\n\n- 2023-01-08 — Invasões e depredações em Brasília (Congresso/STF/Planalto), após confronto com a polícia na Esplanada, segundo cobertura. Status: `documented`. Fonte: [G1](https://g1.globo.com/df/distrito-federal/noticia/2023/01/08/bolsonaristas-radicais-entram-em-confronto-com-a-policia-na-esplanada-e-sobem-rampa-do-congresso-nacional-em-brasilia.ghtml).\n\n### 2023-01-09 — Resposta institucional (exemplo documentado)\n\n- 2023-01-09 — Moraes afasta o governador do DF por 90 dias, citando “omissão e conivência” (trechos na reportagem). Status: `documented`. Fonte: [Folha](https://www1.folha.uol.com.br/poder/2023/01/moraes-afasta-governador-do-df-do-cargo-apos-vandalismo-em-brasilia.shtml).\n\n### 2023-04 — Debate público sobre alertas e falhas\n\n- 2023-04-28 — Publicação da íntegra de alertas da Abin a órgãos do governo antes do 8/1, segundo reportagem. Status: `reported`. Fonte: [Folha](https://www1.folha.uol.com.br/poder/2023/04/veja-integra-dos-alertas-da-abin-ao-gsi-e-ao-ministerio-da-justica-antes-do-81.shtml).\n\n### 2024– — Julgamentos e condenações (STF)\n\n- 2024-08-05 — STF informa condenação de mais 119 pessoas envolvidas (sessões virtuais listadas na nota institucional). Status: `documented`. Fonte: [STF](https://noticias.stf.jus.br/postsnoticias/stf-condena-mais-119-pessoas-pelos-atos-antidemocraticos-de-8-1/).\n\n## Eventos\n\n### 2023\n\n- 2023-01-08 — Invasões/depredações em sedes dos três Poderes em Brasília, segundo cobertura. Status: `documented`. Fonte: [G1](https://g1.globo.com/df/distrito-federal/noticia/2023/01/08/bolsonaristas-radicais-entram-em-confronto-com-a-policia-na-esplanada-e-sobem-rampa-do-congresso-nacional-em-brasilia.ghtml).\n- 2023-01-09 — Afastamento do governador do DF por decisão de Moraes (trechos na reportagem). Status: `documented`. Fonte: [Folha](https://www1.folha.uol.com.br/poder/2023/01/moraes-afasta-governador-do-df-do-cargo-apos-vandalismo-em-brasilia.shtml).\n- 2023-04-28 — Publicação de alertas da Abin ao GSI e ao Ministério da Justiça antes do 8/1, segundo reportagem. Status: `reported`. Fonte: [Folha](https://www1.folha.uol.com.br/poder/2023/04/veja-integra-dos-alertas-da-abin-ao-gsi-e-ao-ministerio-da-justica-antes-do-81.shtml).\n\n### 2024\n\n- 2024-08-05 — STF informa condenações adicionais (mais 119) em julgamentos virtuais (datas descritas na nota). Status: `documented`. Fonte: [STF](https://noticias.stf.jus.br/postsnoticias/stf-condena-mais-119-pessoas-pelos-atos-antidemocraticos-de-8-1/).\n\n## Pessoas relacionadas\n\n- [Alexandre de Moraes](/demos/pessoas/alexandre-de-moraes) — citado em cobertura por decisões no pós‑8/1. Fonte: [Folha](https://www1.folha.uol.com.br/poder/2023/01/moraes-afasta-governador-do-df-do-cargo-apos-vandalismo-em-brasilia.shtml).\n- [Flávio Dino](/demos/pessoas/flavio-dino) — ministro da Justiça à época, citado em controvérsias públicas sobre imagens (cadeia de custódia). Fonte (exemplo): [Gazeta do Povo](https://www.gazetadopovo.com.br/republica/dino-entrega-imagens-de-apenas-4-das-185-cameras-do-palacio-da-justica/).\n- [Jair Messias Bolsonaro](/demos/pessoas/jair-messias-bolsonaro) — grupos descritos como “bolsonaristas” em cobertura sobre os atos (conexão contextual, sem imputação individual). Fonte: [G1](https://g1.globo.com/df/distrito-federal/noticia/2023/01/08/bolsonaristas-radicais-entram-em-confronto-com-a-policia-na-esplanada-e-sobem-rampa-do-congresso-nacional-em-brasilia.ghtml).\n- Pessoas citadas nas fontes (sem página ainda no Skepvox): Ibaneis Rocha; Anderson Torres; integrantes de forças de segurança e de órgãos de inteligência citados em reportagens.\n\n## Organizações relacionadas\n\n- Instituições citadas nas fontes (sem página ainda no Skepvox): Supremo Tribunal Federal (STF); Congresso Nacional; Presidência da República (Planalto); Agência Brasileira de Inteligência (Abin); GSI; Ministério da Justiça; Polícia Militar do DF.\n\n## Fontes\n\n- G1 — “Terroristas bolsonaristas invadem Congresso Nacional, Palácio do Planalto e STF, em Brasília” (acesso em 2026-01-10): https://g1.globo.com/df/distrito-federal/noticia/2023/01/08/bolsonaristas-radicais-entram-em-confronto-com-a-policia-na-esplanada-e-sobem-rampa-do-congresso-nacional-em-brasilia.ghtml\n- Folha — “Moraes afasta governador do DF do cargo após vandalismo em Brasília” (acesso em 2026-01-10): https://www1.folha.uol.com.br/poder/2023/01/moraes-afasta-governador-do-df-do-cargo-apos-vandalismo-em-brasilia.shtml\n- Folha — “Veja íntegra dos alertas da Abin ao GSI e ao Ministério da Justiça antes do 8/1” (acesso em 2026-01-10): https://www1.folha.uol.com.br/poder/2023/04/veja-integra-dos-alertas-da-abin-ao-gsi-e-ao-ministerio-da-justica-antes-do-81.shtml\n- STF — “STF condena mais 119 pessoas pelos atos antidemocráticos de 8/1” (acesso em 2026-01-10): https://noticias.stf.jus.br/postsnoticias/stf-condena-mais-119-pessoas-pelos-atos-antidemocraticos-de-8-1/\n- Gazeta do Povo — “Dino entrega imagens de apenas 4 das 185 câmeras do Palácio da Justiça” (acesso em 2026-01-10): https://www.gazetadopovo.com.br/republica/dino-entrega-imagens-de-apenas-4-das-185-cameras-do-palacio-da-justica/\n",
  "outboundLinks": [
    {
      "text": "Flávio Dino",
      "href": "/demos/pessoas/flavio-dino"
    },
    {
      "text": "Alexandre de Moraes",
      "href": "/demos/pessoas/alexandre-de-moraes"
    },
    {
      "text": "Flávio Dino",
      "href": "/demos/pessoas/flavio-dino"
    },
    {
      "text": "Alexandre de Moraes",
      "href": "/demos/pessoas/alexandre-de-moraes"
    },
    {
      "text": "Alexandre de Moraes",
      "href": "/demos/pessoas/alexandre-de-moraes"
    },
    {
      "text": "Flávio Dino",
      "href": "/demos/pessoas/flavio-dino"
    },
    {
      "text": "Jair Messias Bolsonaro",
      "href": "/demos/pessoas/jair-messias-bolsonaro"
    }
  ],
  "outboundLinksBySection": [
    {
      "section": "Perguntas abertas (hipóteses)",
      "links": [
        {
          "text": "Flávio Dino",
          "href": "/demos/pessoas/flavio-dino"
        },
        {
          "text": "Alexandre de Moraes",
          "href": "/demos/pessoas/alexandre-de-moraes"
        },
        {
          "text": "Flávio Dino",
          "href": "/demos/pessoas/flavio-dino"
        },
        {
          "text": "Alexandre de Moraes",
          "href": "/demos/pessoas/alexandre-de-moraes"
        }
      ]
    },
    {
      "section": "Pessoas relacionadas",
      "links": [
        {
          "text": "Alexandre de Moraes",
          "href": "/demos/pessoas/alexandre-de-moraes"
        },
        {
          "text": "Flávio Dino",
          "href": "/demos/pessoas/flavio-dino"
        },
        {
          "text": "Jair Messias Bolsonaro",
          "href": "/demos/pessoas/jair-messias-bolsonaro"
        }
      ]
    }
  ],
  "relations": {
    "cases": [],
    "family": [],
    "people": [
      {
        "text": "Alexandre de Moraes",
        "href": "/demos/pessoas/alexandre-de-moraes"
      },
      {
        "text": "Flávio Dino",
        "href": "/demos/pessoas/flavio-dino"
      },
      {
        "text": "Jair Messias Bolsonaro",
        "href": "/demos/pessoas/jair-messias-bolsonaro"
      }
    ],
    "organizations": []
  },
  "relationSectionTitles": {
    "cases": null,
    "family": null,
    "people": "Pessoas relacionadas",
    "organizations": "Organizações relacionadas"
  },
  "openQuestions": [
    {
      "id": "q--case--8-de-janeiro-2023--001",
      "question": "quais alertas prévios existiam (inteligência e segurança), para quem foram enviados, e o que foi feito com eles antes do 08-01?",
      "state": "em-apuracao",
      "hypothesis": "existiam alertas acionáveis e houve falhas/omissões relevantes na resposta preventiva (por ação, inação ou coordenação insuficiente).",
      "counterHypothesis": "os alertas eram genéricos/insuficientes, ou a resposta foi compatível com as informações disponíveis e limitações operacionais.",
      "nextSteps": "coletar íntegra de alertas e encaminhamentos; registros de recebimento e decisões; depoimentos públicos; relatórios de órgãos de controle. Fonte-alvo inicial: [Folha](https://www1.folha.uol.com.br/poder/2023/04/veja-integra-dos-alertas-da-abin-ao-gsi-e-ao-ministerio-da-justica-antes-do-81.shtml).",
      "advancingNotes": [
        "/demos/pessoas/flavio-dino",
        "/demos/pessoas/alexandre-de-moraes"
      ]
    },
    {
      "id": "q--case--8-de-janeiro-2023--002",
      "question": "a cadeia de custódia de imagens e outros materiais (câmeras/servidores/anexos) é auditável e preservada de ponta a ponta?",
      "state": "em-apuracao",
      "hypothesis": "há lacunas relevantes de preservação/entrega/documentação que prejudicam auditoria pública e judicial do que ocorreu e de quem fez o quê.",
      "counterHypothesis": "a cadeia de custódia é suficientemente documentada (apreensão, cópias forenses, perícias) e as lacunas aparentes têm explicação técnica/administrativa verificável.",
      "nextSteps": "identificar repositórios oficiais, laudos e termos de apreensão; mapear quais conjuntos de imagens existem, quais foram anexados a inquéritos e quais não; checar decisões e perícias citadas publicamente.",
      "advancingNotes": [
        "/demos/pessoas/flavio-dino",
        "/demos/pessoas/alexandre-de-moraes"
      ]
    },
    {
      "id": "q--case--8-de-janeiro-2023--003",
      "question": "existe evidência pública robusta de infiltração/provocação (por qualquer grupo político, estatal ou não) para escalar vandalismo e/ou produzir pretexto para prisões?",
      "state": "aberta",
      "hypothesis": "houve infiltração/provocação com objetivo de maximizar dano simbólico e influenciar desdobramentos políticos/judiciais.",
      "counterHypothesis": "a explicação mais consistente é a participação voluntária de manifestantes e redes de mobilização já identificadas nas investigações, sem evidência verificável de “false flag”.",
      "nextSteps": "buscar indícios documentais e não apenas inferências; checar se há inquéritos, denúncias ou decisões que tratem especificamente da hipótese; comparar com evidências materiais (vídeos, perícias, identificação).",
      "advancingNotes": []
    },
    {
      "id": "q--case--8-de-janeiro-2023--004",
      "question": "qual foi o nível de coordenação e financiamento (logística, transporte, comunicação) e quais atores podem ser responsabilizados por isso?",
      "state": "aberta",
      "hypothesis": "existiu coordenação financiada (rede) com rastros verificáveis (pagamentos, mensagens, logística) além de “autoria individual”.",
      "counterHypothesis": "a mobilização foi majoritariamente difusa, com coordenação limitada e sem um núcleo financiador identificável publicamente.",
      "nextSteps": "mapear decisões e denúncias que tratem de financiamento; buscar dados de quebras de sigilo já publicadas; acompanhar sentenças e votos que descrevam elementos de coordenação.",
      "advancingNotes": []
    }
  ]
}
