{
  "schema": "skepvox--demos-note",
  "schemaVersion": 1,
  "source": {
    "path": "src/demos/casos/sitio-de-atibaia.md",
    "sha256": "50a9a88db9d7d1daa4ed5fb6107dbd1a5599c5c870c1b8e8bc07f99afadc2267"
  },
  "id": "case--sitio-de-atibaia",
  "type": "case",
  "url": "/demos/casos/sitio-de-atibaia",
  "title": "Sítio de Atibaia",
  "description": "Resumo, linha do tempo e fontes públicas sobre o caso do sítio de Atibaia (Lava Jato) envolvendo Luiz Inácio Lula da Silva.",
  "updatedAt": "2026-01-09",
  "demos": {
    "id": "case--sitio-de-atibaia",
    "type": "case",
    "mapLabel": "sitio-atibaia",
    "seed": "no",
    "seed-id": "person--luiz-inacio-lula-da-silva",
    "target-questions": [
      "q--person-luiz-inacio-lula-da-silva-rede-influencia-timing-desfechos",
      "q--case-operacao-lava-jato-influencia-indevida-conducao-alvos-timing"
    ],
    "country": "BR",
    "aliases": [
      "Caso do sítio de Atibaia",
      "Sítio Santa Bárbara (Atibaia)"
    ],
    "tags": [
      "justica",
      "lava-jato"
    ]
  },
  "frontmatter": {
    "title": "Sítio de Atibaia",
    "description": "Resumo, linha do tempo e fontes públicas sobre o caso do sítio de Atibaia (Lava Jato) envolvendo Luiz Inácio Lula da Silva.",
    "demos": {
      "id": "case--sitio-de-atibaia",
      "type": "case",
      "mapLabel": "sitio-atibaia",
      "seed": "no",
      "seed-id": "person--luiz-inacio-lula-da-silva",
      "target-questions": [
        "q--person-luiz-inacio-lula-da-silva-rede-influencia-timing-desfechos",
        "q--case-operacao-lava-jato-influencia-indevida-conducao-alvos-timing"
      ],
      "country": "BR",
      "aliases": [
        "Caso do sítio de Atibaia",
        "Sítio Santa Bárbara (Atibaia)"
      ],
      "tags": [
        "justica",
        "lava-jato"
      ]
    }
  },
  "frontmatterYaml": "title: \"Sítio de Atibaia\"\ndescription: \"Resumo, linha do tempo e fontes públicas sobre o caso do sítio de Atibaia (Lava Jato) envolvendo Luiz Inácio Lula da Silva.\"\ndemos:\n  id: case--sitio-de-atibaia\n  type: case\n  mapLabel: sitio-atibaia\n  seed: no\n  seed-id: person--luiz-inacio-lula-da-silva\n  target-questions:\n    - q--person-luiz-inacio-lula-da-silva-rede-influencia-timing-desfechos\n    - q--case-operacao-lava-jato-influencia-indevida-conducao-alvos-timing\n  country: BR\n  aliases:\n    - Caso do sítio de Atibaia\n    - Sítio Santa Bárbara (Atibaia)\n  tags:\n    - justica\n    - lava-jato",
  "bodyMarkdown": "# Sítio de Atibaia\n\n::: info Nota editorial (Skepvox)\nEste é um caso controverso. O objetivo aqui é registrar **cronologia**, **status\nprocessual** e **fontes** — sem tratar alegações como fatos e sem concluir além\ndo que está documentado.\n:::\n\n_Última atualização: 2026-01-09. ID Skepvox: `case--sitio-de-atibaia`._\n\n## Situação atual\n\n- Status: houve condenações em 1ª (2019) e 2ª instância (2019), mas o STF confirmou em 2021 a anulação das condenações ligadas à Lava Jato em decisão sobre competência (segundo notícia institucional). Fontes: [TRF4](https://www.trf4.jus.br/trf4/controlador.php?acao=noticia_visualizar&id_noticia=14914), [STF](https://portal.stf.jus.br/noticias/verNoticiaDetalhe.asp?idConteudo=464261&ori=1).\n\n## Por que está no mapa\n\n- Conexão de origem: rede inicial de [Luiz Inácio Lula da Silva (Lula)](/demos/pessoas/luiz-inacio-lula-da-silva) (semente), via [Operação Lava Jato](/demos/casos/operacao-lava-jato).\n- Perguntas-alvo (rastreamento): `q--person-luiz-inacio-lula-da-silva-rede-influencia-timing-desfechos`; `q--case-operacao-lava-jato-influencia-indevida-conducao-alvos-timing`.\n- Evidência mínima: caso com condenações em 2019 e posterior anulação confirmada pelo STF em 2021 (competência), com impacto no status jurídico do investigado/denunciado. Fontes: [G1](https://g1.globo.com/pr/parana/noticia/2019/02/06/lula-e-condenado-em-acao-da-lava-jato-sobre-sitio-de-atibaia.ghtml), [STF](https://portal.stf.jus.br/noticias/verNoticiaDetalhe.asp?idConteudo=464261&ori=1).\n- Fontes‑alvo (próximos passos): sentença, acórdãos (TRF-4/STF), peças e decisões integrais, e movimentação processual para auditoria cronológica.\n\n## Perguntas abertas (hipóteses)\n\n- `q--case-sitio-de-atibaia-influencia-indevida-acelerar-anular-retardar` — Pergunta: o caso foi afetado por influência indevida (política/institucional) — seja para acelerar, seja para anular/retardar? Estado: `em-apuracao`.\n  - Hipótese: houve influência indevida que afetou o ritmo e/ou o desfecho (acelerar, anular ou retardar).\n  - Contra‑hipótese: os desfechos decorrem principalmente de fundamentos jurídicos (competência, nulidades, devido processo).\n  - Próximos passos: coletar decisões integrais, votos e fundamentos; mapear cronologia completa; comparar com casos semelhantes.\n  - Notas que avançam: [Luiz Edson Fachin](/demos/pessoas/luiz-edson-fachin).\n\n## Resumo\n\n- Em 2019, Lula foi condenado em 1ª instância no processo do sítio de Atibaia por corrupção e lavagem (segundo decisão reportada). Fonte: [G1](https://g1.globo.com/pr/parana/noticia/2019/02/06/lula-e-condenado-em-acao-da-lava-jato-sobre-sitio-de-atibaia.ghtml).\n- Em 2019, o TRF-4 confirmou a condenação e alterou a pena, segundo notícia institucional do tribunal. Fonte: [TRF4](https://www.trf4.jus.br/trf4/controlador.php?acao=noticia_visualizar&id_noticia=14914).\n- Em 2021, o STF confirmou (8×3) a anulação das condenações ligadas à Lava Jato, ao rejeitar recurso da PGR contra decisão do ministro Edson Fachin sobre competência do juízo de Curitiba, conforme notícia institucional. Fonte: [STF](https://portal.stf.jus.br/noticias/verNoticiaDetalhe.asp?idConteudo=464261&ori=1).\n\n## Linha do tempo\n\n### 2014–2018 — Lacuna (abertura/início)\n\n- 2014–2018 — Nenhuma informação encontrada até o momento sobre abertura formal do procedimento; a cronologia abaixo começa na sentença de 2019.\n\n### 2019 — Condenação e recurso\n\n- 2019-02-06 — Condenação em 1ª instância (corrupção passiva e lavagem, segundo cobertura). Status: `documented`. Fonte: [G1](https://g1.globo.com/pr/parana/noticia/2019/02/06/lula-e-condenado-em-acao-da-lava-jato-sobre-sitio-de-atibaia.ghtml).\n- 2019-11-27 — TRF-4 confirma condenação em 2ª instância e altera pena (segundo notícia institucional). Status: `documented`. Fonte: [TRF4](https://www.trf4.jus.br/trf4/controlador.php?acao=noticia_visualizar&id_noticia=14914).\n\n### 2021 — Nulidade por competência\n\n- 2021-03-08 — Decisão do ministro Edson Fachin anula condenações ligadas à Lava Jato (por incompetência do juízo de Curitiba, segundo notícia). Status: `documented`. Fonte: [Agência Brasil](https://agenciabrasil.ebc.com.br/justica/noticia/2021-03/fachin-anula-condenacoes-de-lula-na-lava-jato).\n- 2021-04-15 — STF confirma anulação das condenações (8×3), ao rejeitar recurso da PGR (segundo notícia institucional). Status: `documented`. Fonte: [STF](https://portal.stf.jus.br/noticias/verNoticiaDetalhe.asp?idConteudo=464261&ori=1).\n\n## Eventos\n\n### 2019–2021\n\n- 2019-02-06 — Condenação em 1ª instância (corrupção passiva e lavagem, segundo cobertura). Status: `documented`. Fonte: [G1](https://g1.globo.com/pr/parana/noticia/2019/02/06/lula-e-condenado-em-acao-da-lava-jato-sobre-sitio-de-atibaia.ghtml).\n- 2019-11-27 — TRF-4 confirma condenação em 2ª instância e altera pena (segundo notícia institucional). Status: `documented`. Fonte: [TRF4](https://www.trf4.jus.br/trf4/controlador.php?acao=noticia_visualizar&id_noticia=14914).\n- 2021-03-08 — Decisão do ministro Edson Fachin anula condenações ligadas à Lava Jato (por incompetência do juízo de Curitiba, segundo notícia). Status: `documented`. Fonte: [Agência Brasil](https://agenciabrasil.ebc.com.br/justica/noticia/2021-03/fachin-anula-condenacoes-de-lula-na-lava-jato).\n- 2021-04-15 — STF confirma anulação das condenações (8×3), ao rejeitar recurso da PGR (segundo notícia institucional). Status: `documented`. Fonte: [STF](https://portal.stf.jus.br/noticias/verNoticiaDetalhe.asp?idConteudo=464261&ori=1).\n\n## Pessoas relacionadas\n\n- [Luiz Inácio Lula da Silva (Lula)](/demos/pessoas/luiz-inacio-lula-da-silva).\n- [Luiz Edson Fachin](/demos/pessoas/luiz-edson-fachin) — decisão de 2021 sobre competência (efeitos sobre condenações, segundo notícia). Fonte: [STF](https://portal.stf.jus.br/noticias/verNoticiaDetalhe.asp?idConteudo=464261&ori=1).\n\n## Organizações relacionadas\n\n- Instituições citadas nas fontes (sem página ainda no Skepvox): TRF-4; STF; PGR; Justiça Federal.\n\n## Fontes\n\n- G1 — “Lula é condenado a 12 anos e 11 meses de prisão por corrupção e lavagem de dinheiro em ação da Lava Jato sobre sítio de Atibaia” (acesso em 2026-01-09): https://g1.globo.com/pr/parana/noticia/2019/02/06/lula-e-condenado-em-acao-da-lava-jato-sobre-sitio-de-atibaia.ghtml\n- TRF4 — “TRF4 confirma condenação do ex-presidente Lula” (acesso em 2026-01-09): https://www.trf4.jus.br/trf4/controlador.php?acao=noticia_visualizar&id_noticia=14914\n- Agência Brasil — “Fachin anula condenações de Lula na Lava Jato” (acesso em 2026-01-09): https://agenciabrasil.ebc.com.br/justica/noticia/2021-03/fachin-anula-condenacoes-de-lula-na-lava-jato\n- STF — “STF confirma anulação de condenações do ex-presidente Lula na Lava Jato” (acesso em 2026-01-09): https://portal.stf.jus.br/noticias/verNoticiaDetalhe.asp?idConteudo=464261&ori=1\n",
  "outboundLinks": [
    {
      "text": "Luiz Inácio Lula da Silva (Lula)",
      "href": "/demos/pessoas/luiz-inacio-lula-da-silva"
    },
    {
      "text": "Operação Lava Jato",
      "href": "/demos/casos/operacao-lava-jato"
    },
    {
      "text": "Luiz Edson Fachin",
      "href": "/demos/pessoas/luiz-edson-fachin"
    },
    {
      "text": "Luiz Inácio Lula da Silva (Lula)",
      "href": "/demos/pessoas/luiz-inacio-lula-da-silva"
    },
    {
      "text": "Luiz Edson Fachin",
      "href": "/demos/pessoas/luiz-edson-fachin"
    }
  ],
  "outboundLinksBySection": [
    {
      "section": "Por que está no mapa",
      "links": [
        {
          "text": "Luiz Inácio Lula da Silva (Lula)",
          "href": "/demos/pessoas/luiz-inacio-lula-da-silva"
        },
        {
          "text": "Operação Lava Jato",
          "href": "/demos/casos/operacao-lava-jato"
        }
      ]
    },
    {
      "section": "Perguntas abertas (hipóteses)",
      "links": [
        {
          "text": "Luiz Edson Fachin",
          "href": "/demos/pessoas/luiz-edson-fachin"
        }
      ]
    },
    {
      "section": "Pessoas relacionadas",
      "links": [
        {
          "text": "Luiz Inácio Lula da Silva (Lula)",
          "href": "/demos/pessoas/luiz-inacio-lula-da-silva"
        },
        {
          "text": "Luiz Edson Fachin",
          "href": "/demos/pessoas/luiz-edson-fachin"
        }
      ]
    }
  ],
  "relations": {
    "cases": [],
    "people": [
      {
        "text": "Luiz Inácio Lula da Silva (Lula)",
        "href": "/demos/pessoas/luiz-inacio-lula-da-silva"
      },
      {
        "text": "Luiz Edson Fachin",
        "href": "/demos/pessoas/luiz-edson-fachin"
      }
    ],
    "organizations": []
  },
  "relationSectionTitles": {
    "cases": null,
    "people": "Pessoas relacionadas",
    "organizations": "Organizações relacionadas"
  },
  "openQuestions": [
    {
      "id": "q--case-sitio-de-atibaia-influencia-indevida-acelerar-anular-retardar",
      "question": "o caso foi afetado por influência indevida (política/institucional) — seja para acelerar, seja para anular/retardar?",
      "state": "em-apuracao",
      "hypothesis": "houve influência indevida que afetou o ritmo e/ou o desfecho (acelerar, anular ou retardar).",
      "counterHypothesis": null,
      "nextSteps": "coletar decisões integrais, votos e fundamentos; mapear cronologia completa; comparar com casos semelhantes.",
      "advancingNotes": [
        "/demos/pessoas/luiz-edson-fachin"
      ]
    }
  ]
}
