{
  "schema": "skepvox--demos-note",
  "schemaVersion": 1,
  "source": {
    "path": "src/demos/organizacoes/banco-master.md",
    "sha256": "93ede81c7f4010f21d4913a1b46a176032306ef1e2887207c2a84655a639dae9"
  },
  "id": "org--banco-master",
  "type": "org",
  "url": "/demos/organizacoes/banco-master",
  "title": "Banco Master",
  "description": "Resumo factual e fontes públicas sobre o Banco Master e seus desdobramentos no caso de liquidação extrajudicial.",
  "updatedAt": "2026-01-12",
  "demos": {
    "id": "org--banco-master",
    "type": "org",
    "mapLabel": "banco-master",
    "seed": "no",
    "seed-id": "case--caso-banco-master",
    "target-questions": [
      "q--case--caso-banco-master--001",
      "q--case--caso-banco-master--002",
      "q--case--caso-banco-master--003"
    ],
    "country": "BR",
    "identifiers": {
      "cnpj": "33923798000100"
    },
    "aliases": [
      "Master"
    ],
    "tags": [
      "banco",
      "sistema-financeiro",
      "investigacao",
      "brasil"
    ]
  },
  "frontmatter": {
    "title": "Banco Master",
    "description": "Resumo factual e fontes públicas sobre o Banco Master e seus desdobramentos no caso de liquidação extrajudicial.",
    "demos": {
      "id": "org--banco-master",
      "type": "org",
      "mapLabel": "banco-master",
      "seed": "no",
      "seed-id": "case--caso-banco-master",
      "target-questions": [
        "q--case--caso-banco-master--001",
        "q--case--caso-banco-master--002",
        "q--case--caso-banco-master--003"
      ],
      "country": "BR",
      "identifiers": {
        "cnpj": "33923798000100"
      },
      "aliases": [
        "Master"
      ],
      "tags": [
        "banco",
        "sistema-financeiro",
        "investigacao",
        "brasil"
      ]
    }
  },
  "frontmatterYaml": "title: \"Banco Master\"\ndescription: \"Resumo factual e fontes públicas sobre o Banco Master e seus desdobramentos no caso de liquidação extrajudicial.\"\ndemos:\n  id: org--banco-master\n  type: org\n  mapLabel: banco-master\n  seed: no\n  seed-id: case--caso-banco-master\n  target-questions:\n    - q--case--caso-banco-master--001\n    - q--case--caso-banco-master--002\n    - q--case--caso-banco-master--003\n  country: BR\n  identifiers:\n    cnpj: \"33923798000100\"\n  aliases:\n    - Master\n  tags:\n    - banco\n    - sistema-financeiro\n    - investigacao\n    - brasil",
  "bodyMarkdown": "# Banco Master\n\n::: info Nota editorial (Skepvox)\nEsta organização entra no mapa como “nó-hub” do [Caso Banco Master](/demos/casos/caso-banco-master).\nO objetivo é registrar fatos públicos com linguagem neutra, separando relatos jornalísticos,\natos documentados e hipóteses investigáveis.\n:::\n\n_Última atualização: 2026-01-12. ID Skepvox: `org--banco-master`._\n\n<DemosEntityMap />\n\n## Situação atual\n\n- Status (alto nível): o Banco Central determinou a liquidação extrajudicial do Banco Master em 2025-11-18, segundo reportagem. Fonte: [G1](https://g1.globo.com/economia/noticia/2025/11/18/banco-central-determina-a-liquidacao-extrajudicial-do-banco-master.ghtml).\n- Identificação (CNPJ): o site do Banco Master cita o CNPJ `33.923.798/0001-00` para o Banco Master S.A. Fonte: [Banco Master (comunicado)](https://www.bancomaster.com.br/).\n- Ato citado: o comunicado no site do Banco Master menciona o “Ato do Presidente do Banco Central do Brasil número 1.369, de 18.11.2025” como base para a liquidação extrajudicial (a íntegra do ato deve ser auditada em fonte primária). Fontes: [Banco Master (comunicado)](https://www.bancomaster.com.br/), [Banco Central — normativo (ato 1369)](https://www.bcb.gov.br/estabilidadefinanceira/exibenormativo?tipo=Ato+do+Presidente&numero=1369).\n- Contexto (alto nível): a crise e a liquidação têm desdobramentos envolvendo investidores (ex.: proteção do FGC, conforme explicadores), investigações e disputas institucionais (BC/TCU/PF/MPF/PGR/STF), segundo cobertura. Fontes (exemplos): [G1](https://g1.globo.com/economia/noticia/2025/11/19/banco-master-o-que-se-sabe-sobre-a-crise.ghtml), [InfoMoney](https://www.infomoney.com.br/politica/rui-costa-afirma-que-competencia-de-liquidar-master-e-do-banco-central/).\n\n## Por que está no mapa\n\n- Conexão de origem: caso [Caso Banco Master](/demos/casos/caso-banco-master) (semente).\n- Perguntas-alvo (rastreamento): `q--case--caso-banco-master--001`; `q--case--caso-banco-master--002`; `q--case--caso-banco-master--003`.\n- Evidência mínima: a instituição foi objeto de liquidação extrajudicial pelo Banco Central, e passou a ser citada em reportagens sobre investigações e impactos em instituições públicas e investidores, segundo cobertura. Fonte: [G1](https://g1.globo.com/economia/noticia/2025/11/19/banco-master-o-que-se-sabe-sobre-a-crise.ghtml).\n- Fontes‑alvo (próximos passos): atos e fundamentação pública do Banco Central; decisões judiciais e peças públicas; relatórios de órgãos de controle (TCU/CGU) quando disponíveis; informações primárias sobre contratos e governança citados em matérias (sempre com triangulação).\n\n## Perguntas abertas (hipóteses)\n\n- `q--org--banco-master--001`\n  - Pergunta: qual era a estrutura societária/grupo econômico e quais ativos e operações eram centrais (CDBs, consignado, carteiras) segundo documentação verificável?\n  - Estado: `em-apuracao`.\n  - Hipótese: uma estrutura de grupo e governança permitiu ampliar captação/risco com transparência insuficiente para o público e para contrapartes.\n  - Contra-hipótese: a estrutura e os ativos eram compatíveis com práticas de mercado/regulação, e as aparentes lacunas decorrem de assimetria de informação e da natureza do processo de liquidação/investigação.\n  - Próximos passos: auditar atos do BC citados em comunicados; mapear estrutura do grupo (entidades, CNPJs e vínculos); buscar demonstrações financeiras/relatórios públicos; coletar decisões que descrevam carteiras/fluxos; cruzar com explicadores técnicos publicados por veículos e órgãos (sem extrapolar).\n  - Notas que avançam: [Banco Master de Investimento](/demos/organizacoes/banco-master-de-investimento); [Banco Letsbank](/demos/organizacoes/banco-letsbank).\n\n## Resumo\n\n- Oferta de produtos de captação (ex.: CDB) e debate sobre cobertura do FGC aparecem como parte do contexto público do caso, segundo explicadores e reportagens. Fontes: [G1](https://g1.globo.com/economia/noticia/2025/11/19/banco-master-o-que-se-sabe-sobre-a-crise.ghtml), [G1 (FGC)](https://g1.globo.com/economia/noticia/2025/11/18/o-que-e-fgc.ghtml).\n- Em 2025-11, a instituição foi liquidada extrajudicialmente pelo Banco Central, segundo cobertura. Fonte: [G1](https://g1.globo.com/economia/noticia/2025/11/18/banco-central-determina-a-liquidacao-extrajudicial-do-banco-master.ghtml).\n- Nota: o comunicado no site do Banco Master cita o CNPJ do Banco Master S.A. e menciona a existência de outras instituições sob liquidação extrajudicial no mesmo contexto (a auditar em fontes primárias). Fonte: [Banco Master (comunicado)](https://www.bancomaster.com.br/).\n\n## Linha do tempo\n\n### 2017–2021 — Origem do controle e rebranding (segundo reportagem)\n\n- 2017–2019 — [Daniel Vorcaro](/demos/pessoas/daniel-vorcaro) compra participação e assume controle de banco que seria rebatizado como Master; rebranding em 2021, segundo reportagem. Status: `reported`. Fonte: [Valor](https://valor.globo.com/financas/noticia/2026/01/09/entenda-o-caso-do-banco-master-e-a-intricada-relao-de-vorcaro-com-o-poder.ghtml).\n\n### 2025 — Crise, tentativa de venda e liquidação\n\n- 2025-09-03 — Banco Central veta operação de compra do Banco Master pelo BRB, segundo reportagem. Status: `reported`. Fonte: [G1](https://g1.globo.com/economia/noticia/2025/09/03/bc-banco-master-brb.ghtml).\n- 2025-11-17 — Fictor anuncia compra do Banco Master, segundo reportagem. Status: `reported`. Fonte: [G1](https://g1.globo.com/economia/noticia/2025/11/17/fictor-anuncia-compra-do-banco-master.ghtml).\n- 2025-11-18 — Banco Central determina a liquidação extrajudicial do Banco Master, segundo reportagem. Status: `reported`. Fonte: [G1](https://g1.globo.com/economia/noticia/2025/11/18/banco-central-determina-a-liquidacao-extrajudicial-do-banco-master.ghtml).\n\n## Eventos\n\n### 2017–2021\n\n- 2017–2021 — Reestruturação e rebranding do banco para “Master”, segundo reportagem. Status: `reported`. Fonte: [Valor](https://valor.globo.com/financas/noticia/2026/01/09/entenda-o-caso-do-banco-master-e-a-intricada-relao-de-vorcaro-com-o-poder.ghtml).\n\n### 2025\n\n- 2025-09-03 — Banco Central veta compra do Banco Master pelo BRB, segundo G1. Status: `reported`. Fonte: [G1](https://g1.globo.com/economia/noticia/2025/09/03/bc-banco-master-brb.ghtml).\n- 2025-11-17 — Fictor anuncia compra do Banco Master, segundo G1. Status: `reported`. Fonte: [G1](https://g1.globo.com/economia/noticia/2025/11/17/fictor-anuncia-compra-do-banco-master.ghtml).\n- 2025-11-18 — Banco Central determina liquidação extrajudicial do Banco Master, segundo G1. Status: `reported`. Fonte: [G1](https://g1.globo.com/economia/noticia/2025/11/18/banco-central-determina-a-liquidacao-extrajudicial-do-banco-master.ghtml).\n\n## Pessoas relacionadas\n\n- [Daniel Vorcaro](/demos/pessoas/daniel-vorcaro) — citado como “dono do banco” em reportagem sobre a prisão, e descrito como presidente em lista publicada pelo G1. Fonte: [G1](https://g1.globo.com/economia/noticia/2025/11/19/banco-master-o-que-se-sabe-sobre-a-crise.ghtml).\n- Pessoas citadas em fontes (sem página ainda no Skepvox): Gabriel Galípolo; Paulo Henrique Costa; Augusto Ferreira Lima.\n\n## Organizações relacionadas\n\n- [Banco Master de Investimento](/demos/organizacoes/banco-master-de-investimento) — citado no comunicado de credores do Banco Master. Fonte: [Banco Master (comunicado)](https://www.bancomaster.com.br/).\n- [Banco Letsbank](/demos/organizacoes/banco-letsbank) — citado no comunicado de credores do Banco Master. Fonte: [Banco Master (comunicado)](https://www.bancomaster.com.br/).\n\n## Casos relacionados\n\n- [Caso Banco Master](/demos/casos/caso-banco-master)\n\n## Fontes\n\n- G1 — “Banco Central determina a liquidação extrajudicial do Banco Master” (acesso em 2026-01-10): https://g1.globo.com/economia/noticia/2025/11/18/banco-central-determina-a-liquidacao-extrajudicial-do-banco-master.ghtml\n- G1 — “Banco Master: o que se sabe sobre a crise e seus impactos” (acesso em 2026-01-10): https://g1.globo.com/economia/noticia/2025/11/19/banco-master-o-que-se-sabe-sobre-a-crise.ghtml\n- G1 — “O que é FGC e qual seu papel no caso do Banco Master?” (acesso em 2026-01-10): https://g1.globo.com/economia/noticia/2025/11/18/o-que-e-fgc.ghtml\n- InfoMoney — “[Rui Costa](/demos/pessoas/rui-costa) afirma que competência de liquidar Master é do Banco Central” (acesso em 2026-01-10): https://www.infomoney.com.br/politica/rui-costa-afirma-que-competencia-de-liquidar-master-e-do-banco-central/\n- Valor — “Entenda o caso do Banco Master e a intrincada relação de Vorcaro com o poder” (acesso em 2026-01-10): https://valor.globo.com/financas/noticia/2026/01/09/entenda-o-caso-do-banco-master-e-a-intricada-relao-de-vorcaro-com-o-poder.ghtml\n- Banco Master — “Em Liquidação Extrajudicial” (comunicado) (acesso em 2026-01-12): https://www.bancomaster.com.br/\n- Banco Central do Brasil — “Exibe normativo” (Ato do Presidente nº 1369) (acesso em 2026-01-12): https://www.bcb.gov.br/estabilidadefinanceira/exibenormativo?tipo=Ato+do+Presidente&numero=1369\n",
  "outboundLinks": [
    {
      "text": "Caso Banco Master",
      "href": "/demos/casos/caso-banco-master"
    },
    {
      "text": "Caso Banco Master",
      "href": "/demos/casos/caso-banco-master"
    },
    {
      "text": "Banco Master de Investimento",
      "href": "/demos/organizacoes/banco-master-de-investimento"
    },
    {
      "text": "Banco Letsbank",
      "href": "/demos/organizacoes/banco-letsbank"
    },
    {
      "text": "Daniel Vorcaro",
      "href": "/demos/pessoas/daniel-vorcaro"
    },
    {
      "text": "Daniel Vorcaro",
      "href": "/demos/pessoas/daniel-vorcaro"
    },
    {
      "text": "Banco Master de Investimento",
      "href": "/demos/organizacoes/banco-master-de-investimento"
    },
    {
      "text": "Banco Letsbank",
      "href": "/demos/organizacoes/banco-letsbank"
    },
    {
      "text": "Caso Banco Master",
      "href": "/demos/casos/caso-banco-master"
    },
    {
      "text": "Rui Costa",
      "href": "/demos/pessoas/rui-costa"
    }
  ],
  "outboundLinksBySection": [
    {
      "section": "Intro",
      "links": [
        {
          "text": "Caso Banco Master",
          "href": "/demos/casos/caso-banco-master"
        }
      ]
    },
    {
      "section": "Por que está no mapa",
      "links": [
        {
          "text": "Caso Banco Master",
          "href": "/demos/casos/caso-banco-master"
        }
      ]
    },
    {
      "section": "Perguntas abertas (hipóteses)",
      "links": [
        {
          "text": "Banco Master de Investimento",
          "href": "/demos/organizacoes/banco-master-de-investimento"
        },
        {
          "text": "Banco Letsbank",
          "href": "/demos/organizacoes/banco-letsbank"
        }
      ]
    },
    {
      "section": "Linha do tempo",
      "links": [
        {
          "text": "Daniel Vorcaro",
          "href": "/demos/pessoas/daniel-vorcaro"
        }
      ]
    },
    {
      "section": "Pessoas relacionadas",
      "links": [
        {
          "text": "Daniel Vorcaro",
          "href": "/demos/pessoas/daniel-vorcaro"
        }
      ]
    },
    {
      "section": "Organizações relacionadas",
      "links": [
        {
          "text": "Banco Master de Investimento",
          "href": "/demos/organizacoes/banco-master-de-investimento"
        },
        {
          "text": "Banco Letsbank",
          "href": "/demos/organizacoes/banco-letsbank"
        }
      ]
    },
    {
      "section": "Casos relacionados",
      "links": [
        {
          "text": "Caso Banco Master",
          "href": "/demos/casos/caso-banco-master"
        }
      ]
    },
    {
      "section": "Fontes",
      "links": [
        {
          "text": "Rui Costa",
          "href": "/demos/pessoas/rui-costa"
        }
      ]
    }
  ],
  "relations": {
    "cases": [
      {
        "text": "Caso Banco Master",
        "href": "/demos/casos/caso-banco-master"
      }
    ],
    "family": [],
    "people": [
      {
        "text": "Daniel Vorcaro",
        "href": "/demos/pessoas/daniel-vorcaro"
      }
    ],
    "organizations": [
      {
        "text": "Banco Master de Investimento",
        "href": "/demos/organizacoes/banco-master-de-investimento"
      },
      {
        "text": "Banco Letsbank",
        "href": "/demos/organizacoes/banco-letsbank"
      }
    ]
  },
  "relationSectionTitles": {
    "cases": "Casos relacionados",
    "family": null,
    "people": "Pessoas relacionadas",
    "organizations": "Organizações relacionadas"
  },
  "openQuestions": [
    {
      "id": "q--org--banco-master--001",
      "question": "qual era a estrutura societária/grupo econômico e quais ativos e operações eram centrais (CDBs, consignado, carteiras) segundo documentação verificável?",
      "state": "em-apuracao",
      "hypothesis": "uma estrutura de grupo e governança permitiu ampliar captação/risco com transparência insuficiente para o público e para contrapartes.",
      "counterHypothesis": "a estrutura e os ativos eram compatíveis com práticas de mercado/regulação, e as aparentes lacunas decorrem de assimetria de informação e da natureza do processo de liquidação/investigação.",
      "nextSteps": "auditar atos do BC citados em comunicados; mapear estrutura do grupo (entidades, CNPJs e vínculos); buscar demonstrações financeiras/relatórios públicos; coletar decisões que descrevam carteiras/fluxos; cruzar com explicadores técnicos publicados por veículos e órgãos (sem extrapolar).",
      "advancingNotes": [
        "/demos/organizacoes/banco-master-de-investimento",
        "/demos/organizacoes/banco-letsbank"
      ]
    }
  ]
}
