{
  "schema": "skepvox--demos-note",
  "schemaVersion": 1,
  "source": {
    "path": "src/demos/pessoas/alexandre-de-moraes.md",
    "sha256": "dfd7ae95f2f93b897f9edcab07119ac9aa6f9543bbdb5638fa24b726a83348d5"
  },
  "id": "person--alexandre-de-moraes",
  "type": "person",
  "url": "/demos/pessoas/alexandre-de-moraes",
  "title": "Alexandre de Moraes",
  "description": "Linha do tempo e fontes públicas sobre Alexandre de Moraes, ministro do STF.",
  "updatedAt": "2026-01-10",
  "demos": {
    "id": "person--alexandre-de-moraes",
    "type": "person",
    "mapLabel": "alexandre-de-moraes",
    "portrait": "alexandre-de-moraes.png",
    "seed": "no",
    "seed-id": "case--8-de-janeiro-2023",
    "target-questions": [
      "q--case--8-de-janeiro-2023--001",
      "q--case--8-de-janeiro-2023--002"
    ],
    "country": "BR",
    "identifiers": {
      "wikidata": "Q22294946",
      "wikipedia": "https://pt.wikipedia.org/wiki/Alexandre_de_Moraes"
    },
    "aliases": [
      "Alexandre de Moraes"
    ],
    "tags": [
      "judiciario",
      "stf",
      "investigacao",
      "8-jan",
      "banco-master"
    ]
  },
  "frontmatter": {
    "title": "Alexandre de Moraes",
    "description": "Linha do tempo e fontes públicas sobre Alexandre de Moraes, ministro do STF.",
    "demos": {
      "id": "person--alexandre-de-moraes",
      "type": "person",
      "mapLabel": "alexandre-de-moraes",
      "portrait": "alexandre-de-moraes.png",
      "seed": "no",
      "seed-id": "case--8-de-janeiro-2023",
      "target-questions": [
        "q--case--8-de-janeiro-2023--001",
        "q--case--8-de-janeiro-2023--002"
      ],
      "country": "BR",
      "identifiers": {
        "wikidata": "Q22294946",
        "wikipedia": "https://pt.wikipedia.org/wiki/Alexandre_de_Moraes"
      },
      "aliases": [
        "Alexandre de Moraes"
      ],
      "tags": [
        "judiciario",
        "stf",
        "investigacao",
        "8-jan",
        "banco-master"
      ]
    }
  },
  "frontmatterYaml": "title: 'Alexandre de Moraes'\ndescription: 'Linha do tempo e fontes públicas sobre Alexandre de Moraes, ministro do STF.'\ndemos:\n  id: person--alexandre-de-moraes\n  type: person\n  mapLabel: alexandre-de-moraes\n  portrait: alexandre-de-moraes.png\n  seed: no\n  seed-id: case--8-de-janeiro-2023\n  target-questions:\n    - q--case--8-de-janeiro-2023--001\n    - q--case--8-de-janeiro-2023--002\n  country: BR\n  identifiers:\n    wikidata: Q22294946\n    wikipedia: https://pt.wikipedia.org/wiki/Alexandre_de_Moraes\n  aliases:\n    - Alexandre de Moraes\n  tags:\n    - judiciario\n    - stf\n    - investigacao\n    - 8-jan\n    - banco-master",
  "bodyMarkdown": "# Alexandre de Moraes\n\n::: info Nota editorial (Skepvox)\nEsta página entra no mapa por ser ator institucional diretamente citado em fontes ligadas\nao caso de 8 de janeiro de 2023 e por aparecer em desdobramentos públicos do Caso [Banco Master](/demos/organizacoes/banco-master).\nO objetivo é registrar cronologia e status com linguagem neutra e fontes públicas.\n:::\n\n_Última atualização: 2026-01-10. ID Skepvox: `person--alexandre-de-moraes`._\n\n<DemosPortraitSvg />\n\n## Situação atual\n\n- Cargo: ministro do Supremo Tribunal Federal (STF), segundo biografia enciclopédica. Fonte: [Wikipédia](https://pt.wikipedia.org/wiki/Alexandre_de_Moraes).\n- Atuação documentada no pós-8/1 (exemplo): em 2023-01-09, Moraes determinou o afastamento do governador do DF por 90 dias após os atos, segundo reportagem que reproduz trechos da decisão. Fonte: [Folha](https://www1.folha.uol.com.br/poder/2023/01/moraes-afasta-governador-do-df-do-cargo-apos-vandalismo-em-brasilia.shtml).\n- Caso [Banco Master](/demos/organizacoes/banco-master) (desdobramento institucional): segundo a Agência Brasil, a PGR arquivou pedido para investigar Moraes e sua esposa no contexto do caso [Master](/demos/organizacoes/banco-master), citando ausência de lastro probatório mínimo; a matéria também relata que Moraes afirmou que reuniões com o presidente do BC trataram de Lei Magnitsky. Fonte: [Agência Brasil](https://agenciabrasil.ebc.com.br/justica/noticia/2025-12/pgr-descarta-ilicitude-e-arquiva-pedido-para-investigar-moraes).\n\n## Por que está no mapa\n\n- Conexão de origem: caso [8 de Janeiro de 2023](/demos/casos/8-de-janeiro-2023) (semente).\n- Perguntas-alvo (rastreamento): `q--case--8-de-janeiro-2023--001`; `q--case--8-de-janeiro-2023--002`.\n- Evidência mínima: figura institucional central em decisões e atos citados em coberturas sobre o pós-8/1 (ex.: afastamento do governador do DF), o que torna relevante mapear cronologia e fundamentação com fontes. Fonte: [Folha](https://www1.folha.uol.com.br/poder/2023/01/moraes-afasta-governador-do-df-do-cargo-apos-vandalismo-em-brasilia.shtml).\n- Fontes‑alvo (próximos passos): decisões integrais e acórdãos; peças públicas em inquéritos/processos; documentação de cadeia de custódia (imagens, perícias, anexos) citada em reportagens; e atos oficiais ligados ao caso [Master](/demos/organizacoes/banco-master) (quando aplicável).\n\n## Perguntas abertas (hipóteses)\n\n- `q--person--alexandre-de-moraes--001`\n  - Pergunta: as decisões mais citadas no pós‑8/1 (ex.: afastamentos e medidas cautelares) têm íntegra acessível e permitem auditoria pública de fundamentos, provas e proporcionalidade?\n  - Estado: `aberta`.\n  - Hipótese: há documentação pública suficiente (decisões/votos/acórdãos) para auditar fundamentos e requisitos legais, reduzindo “guerra de narrativas”.\n  - Contra-hipótese: parte relevante permanece inacessível ou excessivamente dependente de fontes secundárias, o que dificulta auditoria pública e amplia especulações.\n  - Próximos passos: localizar decisões integrais e votos; mapear o que é sigiloso e o que é público; registrar trechos relevantes com referência precisa.\n  - Notas que avançam: nenhuma ainda.\n- `q--person--alexandre-de-moraes--002`\n  - Pergunta: quais foram, exatamente, as alegações e o escopo do pedido de investigação arquivado pela PGR no contexto do caso [Master](/demos/organizacoes/banco-master), e qual documentação sustenta o arquivamento?\n  - Estado: `aberta`.\n  - Hipótese: o arquivamento se sustenta em ausência de lastro probatório mínimo, conforme descrito pela PGR na matéria, e a documentação (despacho/representação) permite auditoria do escopo.\n  - Contra-hipótese: há informação relevante não publicizada, e o debate público segue baseado em reportagens e interpretações sem documentação acessível.\n  - Próximos passos: buscar despacho integral e anexos; mapear fontes primárias disponíveis; acompanhar eventuais desdobramentos em órgãos de controle.\n  - Notas que avançam: nenhuma ainda.\n\n## Identidade (básico)\n\n- Nome: Alexandre de Moraes. Fonte: [Wikipédia](https://pt.wikipedia.org/wiki/Alexandre_de_Moraes).\n\n## Linha do tempo\n\n### 1968–2017 — Formação e carreira (alto nível, enciclopédico)\n\n- 1968 — Nascimento (alto nível). Status: `reported`. Fonte: [Wikipédia](https://pt.wikipedia.org/wiki/Alexandre_de_Moraes).\n- 2017 — Assume como ministro do STF (alto nível, enciclopédico). Status: `reported`. Fonte: [Wikipédia](https://pt.wikipedia.org/wiki/Alexandre_de_Moraes).\n\n### 2023 — Atos e decisões citados no pós‑8/1 (exemplo documentado)\n\n- 2023-01-09 — Afastamento do governador do DF por 90 dias após os atos de 8/1 (trechos na reportagem). Status: `reported`. Fonte: [Folha](https://www1.folha.uol.com.br/poder/2023/01/moraes-afasta-governador-do-df-do-cargo-apos-vandalismo-em-brasilia.shtml).\n\n### 2025 — Caso [Master](/demos/organizacoes/banco-master) (segundo fonte pública)\n\n- 2025-12-27 — Despacho de arquivamento é publicado (segundo a matéria) no contexto de pedido para investigar Moraes e sua esposa no caso [Master](/demos/organizacoes/banco-master). Status: `reported`. Fonte: [Agência Brasil](https://agenciabrasil.ebc.com.br/justica/noticia/2025-12/pgr-descarta-ilicitude-e-arquiva-pedido-para-investigar-moraes).\n\n## Eventos\n\n### 2023\n\n- 2023-01-09 — Reportagem cita afastamento do governador do DF por decisão de Moraes (trechos reproduzidos). Status: `reported`. Fonte: [Folha](https://www1.folha.uol.com.br/poder/2023/01/moraes-afasta-governador-do-df-do-cargo-apos-vandalismo-em-brasilia.shtml).\n\n### 2025\n\n- 2025-12-27 — Arquivamento noticiado de pedido de investigação no contexto do caso [Master](/demos/organizacoes/banco-master) (segundo a Agência Brasil). Status: `reported`. Fonte: [Agência Brasil](https://agenciabrasil.ebc.com.br/justica/noticia/2025-12/pgr-descarta-ilicitude-e-arquiva-pedido-para-investigar-moraes).\n\n## Casos relacionados\n\n- [8 de Janeiro de 2023](/demos/casos/8-de-janeiro-2023)\n- [Caso Banco Master](/demos/casos/caso-banco-master)\n\n## Fontes\n\n- Wikipédia — “Alexandre de Moraes” (acesso em 2026-01-10): https://pt.wikipedia.org/wiki/Alexandre_de_Moraes\n- Wikidata — “Alexandre de Moraes” (Q22294946) (acesso em 2026-01-10): https://www.wikidata.org/wiki/Q22294946\n- Folha — “Moraes afasta governador do DF do cargo após vandalismo em Brasília” (acesso em 2026-01-10): https://www1.folha.uol.com.br/poder/2023/01/moraes-afasta-governador-do-df-do-cargo-apos-vandalismo-em-brasilia.shtml\n- Agência Brasil — “PGR descarta ilicitude e arquiva pedido para investigar Moraes” (acesso em 2026-01-10): https://agenciabrasil.ebc.com.br/justica/noticia/2025-12/pgr-descarta-ilicitude-e-arquiva-pedido-para-investigar-moraes\n",
  "outboundLinks": [
    {
      "text": "Banco Master",
      "href": "/demos/organizacoes/banco-master"
    },
    {
      "text": "Banco Master",
      "href": "/demos/organizacoes/banco-master"
    },
    {
      "text": "Master",
      "href": "/demos/organizacoes/banco-master"
    },
    {
      "text": "8 de Janeiro de 2023",
      "href": "/demos/casos/8-de-janeiro-2023"
    },
    {
      "text": "Master",
      "href": "/demos/organizacoes/banco-master"
    },
    {
      "text": "Master",
      "href": "/demos/organizacoes/banco-master"
    },
    {
      "text": "Master",
      "href": "/demos/organizacoes/banco-master"
    },
    {
      "text": "Master",
      "href": "/demos/organizacoes/banco-master"
    },
    {
      "text": "Master",
      "href": "/demos/organizacoes/banco-master"
    },
    {
      "text": "8 de Janeiro de 2023",
      "href": "/demos/casos/8-de-janeiro-2023"
    },
    {
      "text": "Caso Banco Master",
      "href": "/demos/casos/caso-banco-master"
    }
  ],
  "outboundLinksBySection": [
    {
      "section": "Intro",
      "links": [
        {
          "text": "Banco Master",
          "href": "/demos/organizacoes/banco-master"
        }
      ]
    },
    {
      "section": "Situação atual",
      "links": [
        {
          "text": "Banco Master",
          "href": "/demos/organizacoes/banco-master"
        },
        {
          "text": "Master",
          "href": "/demos/organizacoes/banco-master"
        }
      ]
    },
    {
      "section": "Por que está no mapa",
      "links": [
        {
          "text": "8 de Janeiro de 2023",
          "href": "/demos/casos/8-de-janeiro-2023"
        },
        {
          "text": "Master",
          "href": "/demos/organizacoes/banco-master"
        }
      ]
    },
    {
      "section": "Perguntas abertas (hipóteses)",
      "links": [
        {
          "text": "Master",
          "href": "/demos/organizacoes/banco-master"
        }
      ]
    },
    {
      "section": "Linha do tempo",
      "links": [
        {
          "text": "Master",
          "href": "/demos/organizacoes/banco-master"
        },
        {
          "text": "Master",
          "href": "/demos/organizacoes/banco-master"
        }
      ]
    },
    {
      "section": "Eventos",
      "links": [
        {
          "text": "Master",
          "href": "/demos/organizacoes/banco-master"
        }
      ]
    },
    {
      "section": "Casos relacionados",
      "links": [
        {
          "text": "8 de Janeiro de 2023",
          "href": "/demos/casos/8-de-janeiro-2023"
        },
        {
          "text": "Caso Banco Master",
          "href": "/demos/casos/caso-banco-master"
        }
      ]
    }
  ],
  "relations": {
    "cases": [
      {
        "text": "8 de Janeiro de 2023",
        "href": "/demos/casos/8-de-janeiro-2023"
      },
      {
        "text": "Caso Banco Master",
        "href": "/demos/casos/caso-banco-master"
      }
    ],
    "family": [],
    "people": [],
    "organizations": []
  },
  "relationSectionTitles": {
    "cases": "Casos relacionados",
    "family": null,
    "people": null,
    "organizations": null
  },
  "openQuestions": [
    {
      "id": "q--person--alexandre-de-moraes--001",
      "question": "as decisões mais citadas no pós‑8/1 (ex.: afastamentos e medidas cautelares) têm íntegra acessível e permitem auditoria pública de fundamentos, provas e proporcionalidade?",
      "state": "aberta",
      "hypothesis": "há documentação pública suficiente (decisões/votos/acórdãos) para auditar fundamentos e requisitos legais, reduzindo “guerra de narrativas”.",
      "counterHypothesis": "parte relevante permanece inacessível ou excessivamente dependente de fontes secundárias, o que dificulta auditoria pública e amplia especulações.",
      "nextSteps": "localizar decisões integrais e votos; mapear o que é sigiloso e o que é público; registrar trechos relevantes com referência precisa.",
      "advancingNotes": []
    },
    {
      "id": "q--person--alexandre-de-moraes--002",
      "question": "quais foram, exatamente, as alegações e o escopo do pedido de investigação arquivado pela PGR no contexto do caso [Master](/demos/organizacoes/banco-master), e qual documentação sustenta o arquivamento?",
      "state": "aberta",
      "hypothesis": "o arquivamento se sustenta em ausência de lastro probatório mínimo, conforme descrito pela PGR na matéria, e a documentação (despacho/representação) permite auditoria do escopo.",
      "counterHypothesis": "há informação relevante não publicizada, e o debate público segue baseado em reportagens e interpretações sem documentação acessível.",
      "nextSteps": "buscar despacho integral e anexos; mapear fontes primárias disponíveis; acompanhar eventuais desdobramentos em órgãos de controle.",
      "advancingNotes": []
    }
  ]
}
