{
  "schema": "skepvox--demos-note",
  "schemaVersion": 1,
  "source": {
    "path": "src/demos/pessoas/ricardo-lewandowski.md",
    "sha256": "f596705029905b7590215d12c775d9b8e8e55100c0217e6729c37f96f691143b"
  },
  "id": "person--ricardo-lewandowski",
  "type": "person",
  "url": "/demos/pessoas/ricardo-lewandowski",
  "title": "Ricardo Lewandowski",
  "description": "Linha do tempo e fontes públicas sobre Ricardo Lewandowski.",
  "updatedAt": "2026-01-10",
  "demos": {
    "id": "person--ricardo-lewandowski",
    "type": "person",
    "mapLabel": "lewandowski",
    "portrait": "ricardo-lewandowski.png",
    "seed": "no",
    "seed-id": "case--caso-banco-master",
    "target-questions": [
      "q--case--caso-banco-master--003"
    ],
    "country": "BR",
    "identifiers": {
      "wikidata": "Q7322696",
      "wikipedia": "https://pt.wikipedia.org/wiki/Ricardo_Lewandowski"
    },
    "aliases": [
      "Ricardo Lewandowski"
    ],
    "tags": [
      "judiciario",
      "executivo",
      "stf",
      "mjsp",
      "banco-master"
    ]
  },
  "frontmatter": {
    "title": "Ricardo Lewandowski",
    "description": "Linha do tempo e fontes públicas sobre Ricardo Lewandowski.",
    "demos": {
      "id": "person--ricardo-lewandowski",
      "type": "person",
      "mapLabel": "lewandowski",
      "portrait": "ricardo-lewandowski.png",
      "seed": "no",
      "seed-id": "case--caso-banco-master",
      "target-questions": [
        "q--case--caso-banco-master--003"
      ],
      "country": "BR",
      "identifiers": {
        "wikidata": "Q7322696",
        "wikipedia": "https://pt.wikipedia.org/wiki/Ricardo_Lewandowski"
      },
      "aliases": [
        "Ricardo Lewandowski"
      ],
      "tags": [
        "judiciario",
        "executivo",
        "stf",
        "mjsp",
        "banco-master"
      ]
    }
  },
  "frontmatterYaml": "title: \"Ricardo Lewandowski\"\ndescription: \"Linha do tempo e fontes públicas sobre Ricardo Lewandowski.\"\ndemos:\n  id: person--ricardo-lewandowski\n  type: person\n  mapLabel: lewandowski\n  portrait: ricardo-lewandowski.png\n  seed: no\n  seed-id: case--caso-banco-master\n  target-questions:\n    - q--case--caso-banco-master--003\n  country: BR\n  identifiers:\n    wikidata: Q7322696\n    wikipedia: https://pt.wikipedia.org/wiki/Ricardo_Lewandowski\n  aliases:\n    - Ricardo Lewandowski\n  tags:\n    - judiciario\n    - executivo\n    - stf\n    - mjsp\n    - banco-master",
  "bodyMarkdown": "# Ricardo Lewandowski\n\n::: info Nota editorial (Skepvox)\nEsta página existe por causa de menções públicas a vínculos profissionais com o [Banco Master](/demos/organizacoes/banco-master)\ne pela posição institucional (MJSP) ligada a órgãos relevantes no caso (ex.: PF).\nO objetivo é registrar cronologia e fontes, separando reportagem de evidência primária.\n:::\n\n_Última atualização: 2026-01-10. ID Skepvox: `person--ricardo-lewandowski`._\n\n<DemosPortraitSvg />\n\n## Situação atual\n\n- Cargo: ministro da Justiça e Segurança Pública (MJSP), segundo biografia enciclopédica. Fonte: [Wikipédia](https://pt.wikipedia.org/wiki/Ricardo_Lewandowski).\n- Vínculo institucional: o MJSP é a pasta federal à qual a Polícia Federal é vinculada (escopo/organograma não detalhado nesta nota).\n- Vínculo com o caso [Master](/demos/organizacoes/banco-master) (relato jornalístico): reportagem afirma que o [Banco Master](/demos/organizacoes/banco-master) contratou Lewandowski como consultor entre sua aposentadoria no STF e a ida para o MJSP. Fonte: [Valor](https://valor.globo.com/financas/noticia/2026/01/09/entenda-o-caso-do-banco-master-e-a-intricada-relao-de-vorcaro-com-o-poder.ghtml).\n\n## Por que está no mapa\n\n- Conexão de origem: caso [Caso Banco Master](/demos/casos/caso-banco-master) (semente).\n- Perguntas-alvo (rastreamento): `q--case--caso-banco-master--003`.\n- Evidência mínima: é citado em reportagem como consultor contratado pelo [Banco Master](/demos/organizacoes/banco-master) e ocupa cargo ministerial com relevância institucional para o caso (PF/MJSP), o que justifica rastrear cronologia e possíveis pontos de conflito/controvérsia com base em fontes. Fontes: [Valor](https://valor.globo.com/financas/noticia/2026/01/09/entenda-o-caso-do-banco-master-e-a-intricada-relao-de-vorcaro-com-o-poder.ghtml), [Wikipédia](https://pt.wikipedia.org/wiki/Ricardo_Lewandowski).\n- Fontes‑alvo (próximos passos): documentação pública (quando existir) sobre escopo/duração de consultorias e eventuais mecanismos de prevenção de conflito (impedimentos, recusa, transparência); agendas e registros oficiais; decisões ou atos do MJSP/PF citando o caso.\n\n## Perguntas abertas (hipóteses)\n\n- `q--person--ricardo-lewandowski--001`\n  - Pergunta: qual foi o escopo, período e natureza do vínculo de consultoria citado em reportagens (contrato, comitê consultivo, temas, remuneração, encerramento)?\n  - Estado: `aberta`.\n  - Hipótese: o vínculo existiu e seus termos são verificáveis (ou por documentação pública, ou por confirmação formal), permitindo avaliar compatibilidade com regras e eventual necessidade de recusa/impedimento.\n  - Contra-hipótese: parte do relato público é imprecisa (ex.: papel distinto de “consultor”, período diferente, ou vínculo já encerrado sem impacto decisório), e não há evidência de conflito material.\n  - Próximos passos: buscar documentos públicos e declarações formais; procurar registros em decisões, contratos publicizados, e eventuais notas de transparência.\n  - Notas que avançam: nenhuma ainda.\n- `q--person--ricardo-lewandowski--002`\n  - Pergunta: houve medidas documentadas de gestão de conflito (ex.: impedimento/recusa) em atos do MJSP/PF relacionados ao caso [Master](/demos/organizacoes/banco-master)?\n  - Estado: `aberta`.\n  - Hipótese: existem procedimentos formais (ou decisões) registrando mitigação de conflito.\n  - Contra-hipótese: não há ato ou decisão que conecte a consultoria a atuação ministerial no caso; as preocupações são majoritariamente inferenciais, sem evidência de influência.\n  - Próximos passos: mapear atos oficiais, agendas, decisões e comunicados; buscar manifestações do próprio agente e de órgãos de controle.\n  - Notas que avançam: nenhuma ainda.\n\n## Identidade (básico)\n\n- Nome: Ricardo Lewandowski. Fonte: [Wikipédia](https://pt.wikipedia.org/wiki/Ricardo_Lewandowski).\n\n## Linha do tempo\n\n### 1948–2006 — Formação e carreira (alto nível, enciclopédico)\n\n- 1948 — Nascimento (alto nível, enciclopédico). Status: `reported`. Fonte: [Wikipédia](https://pt.wikipedia.org/wiki/Ricardo_Lewandowski).\n- 2006 — Indicado/nomeado ministro do STF (alto nível, enciclopédico). Status: `reported`. Fonte: [Wikipédia](https://pt.wikipedia.org/wiki/Ricardo_Lewandowski).\n\n### 2006–2023 — STF (alto nível, enciclopédico)\n\n- 2006–2023 — Atuação como ministro do STF (e presidência do STF em período citado em biografia enciclopédica). Status: `reported`. Fonte: [Wikipédia](https://pt.wikipedia.org/wiki/Ricardo_Lewandowski).\n\n### 2023–2024 — Aposentadoria e menções a consultoria (segundo reportagem)\n\n- 2023 — Aposentadoria do STF (alto nível). Status: `reported`. Fonte: [Wikipédia](https://pt.wikipedia.org/wiki/Ricardo_Lewandowski).\n- 2026-01-09 — Reportagem afirma que o [Banco Master](/demos/organizacoes/banco-master) contratou Lewandowski como consultor entre a aposentadoria no STF e o cargo no MJSP. Status: `reported`. Fonte: [Valor](https://valor.globo.com/financas/noticia/2026/01/09/entenda-o-caso-do-banco-master-e-a-intricada-relao-de-vorcaro-com-o-poder.ghtml).\n\n### 2024– — Ministério da Justiça e Segurança Pública\n\n- 2024 — Assume o cargo de ministro da Justiça e Segurança Pública (alto nível, enciclopédico). Status: `reported`. Fonte: [Wikipédia](https://pt.wikipedia.org/wiki/Ricardo_Lewandowski).\n\n## Eventos\n\n### 2023–2026\n\n- 2026-01-09 — Reportagem cita consultoria com o [Banco Master](/demos/organizacoes/banco-master) (tratar como reportagem). Status: `reported`. Fonte: [Valor](https://valor.globo.com/financas/noticia/2026/01/09/entenda-o-caso-do-banco-master-e-a-intricada-relao-de-vorcaro-com-o-poder.ghtml).\n\n## Casos relacionados\n\n- [Caso Banco Master](/demos/casos/caso-banco-master)\n\n## Fontes\n\n- Wikipédia — “Ricardo Lewandowski” (acesso em 2026-01-10): https://pt.wikipedia.org/wiki/Ricardo_Lewandowski\n- Wikidata — “Ricardo Lewandowski” (Q7322696) (acesso em 2026-01-10): https://www.wikidata.org/wiki/Q7322696\n- Valor — “Entenda o caso do [Banco Master](/demos/organizacoes/banco-master) e a intrincada relação de Vorcaro com o poder” (acesso em 2026-01-10): https://valor.globo.com/financas/noticia/2026/01/09/entenda-o-caso-do-banco-master-e-a-intricada-relao-de-vorcaro-com-o-poder.ghtml\n",
  "outboundLinks": [
    {
      "text": "Banco Master",
      "href": "/demos/organizacoes/banco-master"
    },
    {
      "text": "Master",
      "href": "/demos/organizacoes/banco-master"
    },
    {
      "text": "Banco Master",
      "href": "/demos/organizacoes/banco-master"
    },
    {
      "text": "Caso Banco Master",
      "href": "/demos/casos/caso-banco-master"
    },
    {
      "text": "Banco Master",
      "href": "/demos/organizacoes/banco-master"
    },
    {
      "text": "Master",
      "href": "/demos/organizacoes/banco-master"
    },
    {
      "text": "Banco Master",
      "href": "/demos/organizacoes/banco-master"
    },
    {
      "text": "Banco Master",
      "href": "/demos/organizacoes/banco-master"
    },
    {
      "text": "Caso Banco Master",
      "href": "/demos/casos/caso-banco-master"
    },
    {
      "text": "Banco Master",
      "href": "/demos/organizacoes/banco-master"
    }
  ],
  "outboundLinksBySection": [
    {
      "section": "Intro",
      "links": [
        {
          "text": "Banco Master",
          "href": "/demos/organizacoes/banco-master"
        }
      ]
    },
    {
      "section": "Situação atual",
      "links": [
        {
          "text": "Master",
          "href": "/demos/organizacoes/banco-master"
        },
        {
          "text": "Banco Master",
          "href": "/demos/organizacoes/banco-master"
        }
      ]
    },
    {
      "section": "Por que está no mapa",
      "links": [
        {
          "text": "Caso Banco Master",
          "href": "/demos/casos/caso-banco-master"
        },
        {
          "text": "Banco Master",
          "href": "/demos/organizacoes/banco-master"
        }
      ]
    },
    {
      "section": "Perguntas abertas (hipóteses)",
      "links": [
        {
          "text": "Master",
          "href": "/demos/organizacoes/banco-master"
        }
      ]
    },
    {
      "section": "Linha do tempo",
      "links": [
        {
          "text": "Banco Master",
          "href": "/demos/organizacoes/banco-master"
        }
      ]
    },
    {
      "section": "Eventos",
      "links": [
        {
          "text": "Banco Master",
          "href": "/demos/organizacoes/banco-master"
        }
      ]
    },
    {
      "section": "Casos relacionados",
      "links": [
        {
          "text": "Caso Banco Master",
          "href": "/demos/casos/caso-banco-master"
        }
      ]
    },
    {
      "section": "Fontes",
      "links": [
        {
          "text": "Banco Master",
          "href": "/demos/organizacoes/banco-master"
        }
      ]
    }
  ],
  "relations": {
    "cases": [
      {
        "text": "Caso Banco Master",
        "href": "/demos/casos/caso-banco-master"
      }
    ],
    "family": [],
    "people": [],
    "organizations": []
  },
  "relationSectionTitles": {
    "cases": "Casos relacionados",
    "family": null,
    "people": null,
    "organizations": null
  },
  "openQuestions": [
    {
      "id": "q--person--ricardo-lewandowski--001",
      "question": "qual foi o escopo, período e natureza do vínculo de consultoria citado em reportagens (contrato, comitê consultivo, temas, remuneração, encerramento)?",
      "state": "aberta",
      "hypothesis": "o vínculo existiu e seus termos são verificáveis (ou por documentação pública, ou por confirmação formal), permitindo avaliar compatibilidade com regras e eventual necessidade de recusa/impedimento.",
      "counterHypothesis": "parte do relato público é imprecisa (ex.: papel distinto de “consultor”, período diferente, ou vínculo já encerrado sem impacto decisório), e não há evidência de conflito material.",
      "nextSteps": "buscar documentos públicos e declarações formais; procurar registros em decisões, contratos publicizados, e eventuais notas de transparência.",
      "advancingNotes": []
    },
    {
      "id": "q--person--ricardo-lewandowski--002",
      "question": "houve medidas documentadas de gestão de conflito (ex.: impedimento/recusa) em atos do MJSP/PF relacionados ao caso [Master](/demos/organizacoes/banco-master)?",
      "state": "aberta",
      "hypothesis": "existem procedimentos formais (ou decisões) registrando mitigação de conflito.",
      "counterHypothesis": "não há ato ou decisão que conecte a consultoria a atuação ministerial no caso; as preocupações são majoritariamente inferenciais, sem evidência de influência.",
      "nextSteps": "mapear atos oficiais, agendas, decisões e comunicados; buscar manifestações do próprio agente e de órgãos de controle.",
      "advancingNotes": []
    }
  ]
}
