{
  "schema": "skepvox--demos-note",
  "schemaVersion": 1,
  "source": {
    "path": "src/demos/pessoas/flavio-dino.md",
    "sha256": "4f0e034b79e51924cb11238d11face733f669448338e8deb0df5949832f04e94"
  },
  "id": "person--flavio-dino",
  "type": "person",
  "url": "/demos/pessoas/flavio-dino",
  "title": "Flávio Dino",
  "description": "Linha do tempo e fontes públicas sobre Flávio Dino.",
  "updatedAt": "2026-01-10",
  "demos": {
    "id": "person--flavio-dino",
    "type": "person",
    "mapLabel": "dino",
    "portrait": "flavio-dino.png",
    "seed": "no",
    "seed-id": "case--8-de-janeiro-2023",
    "target-questions": [
      "q--case--8-de-janeiro-2023--001",
      "q--case--8-de-janeiro-2023--002"
    ],
    "country": "BR",
    "identifiers": {
      "wikidata": "Q10283063",
      "wikipedia": "https://pt.wikipedia.org/wiki/Fl%C3%A1vio_Dino"
    },
    "aliases": [
      "Flávio Dino"
    ],
    "tags": [
      "judiciario",
      "stf",
      "executivo",
      "mjsp",
      "8-jan"
    ]
  },
  "frontmatter": {
    "title": "Flávio Dino",
    "description": "Linha do tempo e fontes públicas sobre Flávio Dino.",
    "demos": {
      "id": "person--flavio-dino",
      "type": "person",
      "mapLabel": "dino",
      "portrait": "flavio-dino.png",
      "seed": "no",
      "seed-id": "case--8-de-janeiro-2023",
      "target-questions": [
        "q--case--8-de-janeiro-2023--001",
        "q--case--8-de-janeiro-2023--002"
      ],
      "country": "BR",
      "identifiers": {
        "wikidata": "Q10283063",
        "wikipedia": "https://pt.wikipedia.org/wiki/Fl%C3%A1vio_Dino"
      },
      "aliases": [
        "Flávio Dino"
      ],
      "tags": [
        "judiciario",
        "stf",
        "executivo",
        "mjsp",
        "8-jan"
      ]
    }
  },
  "frontmatterYaml": "title: \"Flávio Dino\"\ndescription: \"Linha do tempo e fontes públicas sobre Flávio Dino.\"\ndemos:\n  id: person--flavio-dino\n  type: person\n  mapLabel: dino\n  portrait: flavio-dino.png\n  seed: no\n  seed-id: case--8-de-janeiro-2023\n  target-questions:\n    - q--case--8-de-janeiro-2023--001\n    - q--case--8-de-janeiro-2023--002\n  country: BR\n  identifiers:\n    wikidata: Q10283063\n    wikipedia: https://pt.wikipedia.org/wiki/Fl%C3%A1vio_Dino\n  aliases:\n    - Flávio Dino\n  tags:\n    - judiciario\n    - stf\n    - executivo\n    - mjsp\n    - 8-jan",
  "bodyMarkdown": "# Flávio Dino\n\n::: info Nota editorial (Skepvox)\nEsta página entra no mapa por conexão direta com o caso de 8 de janeiro de 2023 (função no Executivo à época)\ne por controvérsias públicas sobre preservação/entrega de imagens (cadeia de custódia).\nO objetivo é registrar fatos e alegações com fonte e status explícitos.\n:::\n\n_Última atualização: 2026-01-10. ID Skepvox: `person--flavio-dino`._\n\n<DemosPortraitSvg />\n\n## Situação atual\n\n- Cargo: ministro do STF (alto nível, enciclopédico). Fonte: [Wikipédia](https://pt.wikipedia.org/wiki/Fl%C3%A1vio_Dino).\n- Papel no contexto do 8/1 (alto nível): ministro da Justiça à época dos atos (segundo biografia enciclopédica). Fonte: [Wikipédia](https://pt.wikipedia.org/wiki/Fl%C3%A1vio_Dino).\n- Imagens do Palácio da Justiça (relato jornalístico): matéria afirma que Dino enviou à CPMI imagens de 4 das 185 câmeras do circuito e descreve justificativas atribuídas ao ministro e ao ministério (inclui menção de que a informação teria sido do Estadão). Fonte: [Gazeta do Povo](https://www.gazetadopovo.com.br/republica/dino-entrega-imagens-de-apenas-4-das-185-cameras-do-palacio-da-justica/).\n\n## Por que está no mapa\n\n- Conexão de origem: caso [8 de Janeiro de 2023](/demos/casos/8-de-janeiro-2023) (semente).\n- Perguntas-alvo (rastreamento): `q--case--8-de-janeiro-2023--001`; `q--case--8-de-janeiro-2023--002`.\n- Evidência mínima: há fontes que atribuem a Dino papel relevante no contexto do pós-8/1 (ministério responsável por segurança pública) e que apontam controvérsias sobre preservação/entrega de imagens, o que torna relevante mapear cronologia e documentos-alvo com cuidado. Fonte: [Gazeta do Povo](https://www.gazetadopovo.com.br/republica/dino-entrega-imagens-de-apenas-4-das-185-cameras-do-palacio-da-justica/).\n- Fontes‑alvo (próximos passos): registros e decisões integrais que tratem de preservação/entrega de imagens; contratos e termos citados; manifestação oficial do MJ e da PF sobre cadeia de custódia e perícias; documentos da CPMI (quando públicos).\n\n## Perguntas abertas (hipóteses)\n\n- `q--person--flavio-dino--001`\n  - Pergunta: quais imagens existiam, por quanto tempo eram armazenadas, quais foram preservadas e entregues (e a quem), e qual documentação pública comprova a cadeia de custódia?\n  - Estado: `aberta`.\n  - Hipótese: há lacunas documentais e/ou decisões administrativas que dificultam auditoria pública do conjunto completo de imagens.\n  - Contra-hipótese: as imagens relevantes foram preservadas e entregues às autoridades competentes (PF/inquéritos), e o restante expirou por regras contratuais; a documentação existe e é verificável.\n  - Próximos passos: localizar ofícios e anexos enviados à CPMI; identificar contratos e termos citados; mapear registros de apreensão/perícia pela PF; buscar decisões judiciais que descrevam os conjuntos de imagens.\n  - Notas que avançam: nenhuma ainda.\n\n## Identidade (básico)\n\n- Nome: Flávio Dino. Fonte: [Wikipédia](https://pt.wikipedia.org/wiki/Fl%C3%A1vio_Dino).\n\n## Linha do tempo\n\n### 1968–2022 — Trajetória (alto nível, enciclopédico)\n\n- 1968 — Nascimento (alto nível). Status: `reported`. Fonte: [Wikipédia](https://pt.wikipedia.org/wiki/Fl%C3%A1vio_Dino).\n- 2015–2022 — Governador do Maranhão (alto nível, enciclopédico). Status: `reported`. Fonte: [Wikipédia](https://pt.wikipedia.org/wiki/Fl%C3%A1vio_Dino).\n\n### 2023 — Ministério da Justiça e 8/1 (alto nível + relato jornalístico)\n\n- 2023 — Ministro da Justiça (alto nível, enciclopédico). Status: `reported`. Fonte: [Wikipédia](https://pt.wikipedia.org/wiki/Fl%C3%A1vio_Dino).\n- 2023-09-01 — Matéria descreve envio de imagens de 4 das 185 câmeras do Palácio da Justiça à CPMI do 8/1 e justifica com referência a contrato e atuação da PF, segundo o texto. Status: `reported`. Fonte: [Gazeta do Povo](https://www.gazetadopovo.com.br/republica/dino-entrega-imagens-de-apenas-4-das-185-cameras-do-palacio-da-justica/).\n\n### 2024– — STF (alto nível, enciclopédico)\n\n- 2024 — Assume como ministro do STF (alto nível, enciclopédico). Status: `reported`. Fonte: [Wikipédia](https://pt.wikipedia.org/wiki/Fl%C3%A1vio_Dino).\n\n## Eventos\n\n### 2023\n\n- 2023-09-01 — Matéria relata envio de imagens de 4 das 185 câmeras à CPMI e descreve justificativas atribuídas a Dino e ao MJ (tratar como fonte secundária). Status: `reported`. Fonte: [Gazeta do Povo](https://www.gazetadopovo.com.br/republica/dino-entrega-imagens-de-apenas-4-das-185-cameras-do-palacio-da-justica/).\n\n## Casos relacionados\n\n- [8 de Janeiro de 2023](/demos/casos/8-de-janeiro-2023)\n\n## Fontes\n\n- Wikipédia — “Flávio Dino” (acesso em 2026-01-10): https://pt.wikipedia.org/wiki/Fl%C3%A1vio_Dino\n- Wikidata — “Flávio Dino” (Q10283063) (acesso em 2026-01-10): https://www.wikidata.org/wiki/Q10283063\n- Gazeta do Povo — “Dino entrega imagens de apenas 4 das 185 câmeras do Palácio da Justiça” (acesso em 2026-01-10): https://www.gazetadopovo.com.br/republica/dino-entrega-imagens-de-apenas-4-das-185-cameras-do-palacio-da-justica/\n",
  "outboundLinks": [
    {
      "text": "8 de Janeiro de 2023",
      "href": "/demos/casos/8-de-janeiro-2023"
    },
    {
      "text": "8 de Janeiro de 2023",
      "href": "/demos/casos/8-de-janeiro-2023"
    }
  ],
  "outboundLinksBySection": [
    {
      "section": "Por que está no mapa",
      "links": [
        {
          "text": "8 de Janeiro de 2023",
          "href": "/demos/casos/8-de-janeiro-2023"
        }
      ]
    },
    {
      "section": "Casos relacionados",
      "links": [
        {
          "text": "8 de Janeiro de 2023",
          "href": "/demos/casos/8-de-janeiro-2023"
        }
      ]
    }
  ],
  "relations": {
    "cases": [
      {
        "text": "8 de Janeiro de 2023",
        "href": "/demos/casos/8-de-janeiro-2023"
      }
    ],
    "family": [],
    "people": [],
    "organizations": []
  },
  "relationSectionTitles": {
    "cases": "Casos relacionados",
    "family": null,
    "people": null,
    "organizations": null
  },
  "openQuestions": [
    {
      "id": "q--person--flavio-dino--001",
      "question": "quais imagens existiam, por quanto tempo eram armazenadas, quais foram preservadas e entregues (e a quem), e qual documentação pública comprova a cadeia de custódia?",
      "state": "aberta",
      "hypothesis": "há lacunas documentais e/ou decisões administrativas que dificultam auditoria pública do conjunto completo de imagens.",
      "counterHypothesis": "as imagens relevantes foram preservadas e entregues às autoridades competentes (PF/inquéritos), e o restante expirou por regras contratuais; a documentação existe e é verificável.",
      "nextSteps": "localizar ofícios e anexos enviados à CPMI; identificar contratos e termos citados; mapear registros de apreensão/perícia pela PF; buscar decisões judiciais que descrevam os conjuntos de imagens.",
      "advancingNotes": []
    }
  ]
}
