{
  "schema": "skepvox--demos-note",
  "schemaVersion": 1,
  "source": {
    "path": "src/demos/pessoas/zanone-manoel-de-oliveira-junior.md",
    "sha256": "e67c540eca643164ccbd480bc77d18865f212c4aa741b7a821cb65fb2dc38e5c"
  },
  "id": "person--zanone-manoel-de-oliveira-junior",
  "type": "person",
  "url": "/demos/pessoas/zanone-manoel-de-oliveira-junior",
  "title": "Zanone Manoel de Oliveira Júnior",
  "description": "Linha do tempo e fontes públicas sobre Zanone Manoel de Oliveira Júnior.",
  "updatedAt": "2026-01-10",
  "demos": {
    "id": "person--zanone-manoel-de-oliveira-junior",
    "type": "person",
    "mapLabel": "zanone",
    "portrait": "zanone-manoel-de-oliveira-junior.png",
    "seed": "no",
    "seed-id": "person--adelio-bispo-de-oliveira",
    "target-questions": [
      "q--case--atentado-contra-jair-bolsonaro--001",
      "q--person--adelio-bispo-de-oliveira--001"
    ],
    "country": "BR",
    "aliases": [
      "Zanone Manoel de Oliveira Junior",
      "Zanone"
    ],
    "tags": [
      "advocacia",
      "oab",
      "atentado-2018",
      "investigacao",
      "justica"
    ]
  },
  "frontmatter": {
    "title": "Zanone Manoel de Oliveira Júnior",
    "description": "Linha do tempo e fontes públicas sobre Zanone Manoel de Oliveira Júnior.",
    "demos": {
      "id": "person--zanone-manoel-de-oliveira-junior",
      "type": "person",
      "mapLabel": "zanone",
      "portrait": "zanone-manoel-de-oliveira-junior.png",
      "seed": "no",
      "seed-id": "person--adelio-bispo-de-oliveira",
      "target-questions": [
        "q--case--atentado-contra-jair-bolsonaro--001",
        "q--person--adelio-bispo-de-oliveira--001"
      ],
      "country": "BR",
      "aliases": [
        "Zanone Manoel de Oliveira Junior",
        "Zanone"
      ],
      "tags": [
        "advocacia",
        "oab",
        "atentado-2018",
        "investigacao",
        "justica"
      ]
    }
  },
  "frontmatterYaml": "title: 'Zanone Manoel de Oliveira Júnior'\ndescription: 'Linha do tempo e fontes públicas sobre Zanone Manoel de Oliveira Júnior.'\ndemos:\n  id: person--zanone-manoel-de-oliveira-junior\n  type: person\n  mapLabel: zanone\n  portrait: zanone-manoel-de-oliveira-junior.png\n  seed: no\n  seed-id: person--adelio-bispo-de-oliveira\n  target-questions:\n    - q--case--atentado-contra-jair-bolsonaro--001\n    - q--person--adelio-bispo-de-oliveira--001\n  country: BR\n  aliases:\n    - Zanone Manoel de Oliveira Junior\n    - Zanone\n  tags:\n    - advocacia\n    - oab\n    - atentado-2018\n    - investigacao\n    - justica",
  "bodyMarkdown": "# Zanone Manoel de Oliveira Júnior\n\n::: info Nota editorial (Skepvox)\nEsta página existe por conexão documentada com o caso\n[Atentado contra Jair Bolsonaro](/demos/casos/atentado-contra-jair-bolsonaro).\nO objetivo é registrar cronologia e fontes sobre o que foi publicado publicamente,\nsem inferir além do que está documentado.\n:::\n\n_Última atualização: 2026-01-10. ID Skepvox: `person--zanone-manoel-de-oliveira-junior`._\n\n<DemosPortraitSvg />\n\n## Situação atual\n\n- Papel no caso (segundo cobertura): advogado que prestou defesa de Adélio “desde o dia seguinte da facada”, citado como foco de uma diligência pendente (análise de conteúdo de celular) no inquérito da PF descrito pela reportagem. Fonte: [G1 (2020-05-14)](https://g1.globo.com/mg/minas-gerais/noticia/2020/05/14/pf-conclui-em-2o-inquerito-que-adelio-agiu-sozinho-e-sem-mandantes-no-ataque-a-bolsonaro.ghtml).\n- Perícia em celular (controvérsia noticiada): segundo o G1, o aparelho foi apreendido em busca e apreensão, mas a perícia foi contestada por ação da OAB no TRF-1 e submetida ao STF; à época da matéria, o STF ainda “não autorizou nem negou” a diligência. Fonte: [G1 (2020-05-14)](https://g1.globo.com/mg/minas-gerais/noticia/2020/05/14/pf-conclui-em-2o-inquerito-que-adelio-agiu-sozinho-e-sem-mandantes-no-ataque-a-bolsonaro.ghtml).\n\n## Por que está no mapa\n\n- Conexão de origem: semente [Adélio Bispo de Oliveira](/demos/pessoas/adelio-bispo-de-oliveira) via o caso [Atentado contra Jair Bolsonaro](/demos/casos/atentado-contra-jair-bolsonaro).\n- Perguntas-alvo (rastreamento): `q--case--atentado-contra-jair-bolsonaro--001`; `q--person--adelio-bispo-de-oliveira--001`.\n- Evidência mínima: aparece como peça factual relevante em cobertura sobre o 2º inquérito (participação de terceiros), porque a reportagem descreve uma diligência pendente envolvendo perícia de celular e disputa jurídica (OAB/TRF-1/STF). Fonte: [G1 (2020-05-14)](https://g1.globo.com/mg/minas-gerais/noticia/2020/05/14/pf-conclui-em-2o-inquerito-que-adelio-agiu-sozinho-e-sem-mandantes-no-ataque-a-bolsonaro.ghtml).\n- Fontes-alvo (próximos passos): decisões/acórdãos (TRF-1/STF) sobre a perícia; número do procedimento; delimitação de escopo (sigilo profissional, cadeia de custódia e relevância); documentos públicos que esclareçam se a diligência ocorreu e qual foi o resultado.\n\n## Perguntas abertas (hipóteses)\n\n- `q--person--zanone-manoel-de-oliveira-junior--001`\n  - Pergunta: qual é o número do processo/medida no TRF-1 e no STF sobre a perícia no celular e qual foi o desfecho (decisão, fundamentação e datas)?\n  - Estado: `aberta`.\n  - Hipótese: há registro público suficiente (ao menos com número, classe e movimentação) para documentar o desfecho e os limites impostos à diligência.\n  - Contra‑hipótese: o caso não é rastreável publicamente (sigilo, ausência de número em fontes abertas) e o desfecho permanece indeterminado do ponto de vista externo.\n  - Próximos passos: identificar número a partir de fontes públicas; localizar decisão/acórdão (TRF-1/STF); registrar cronologia e fundamentos; checar se houve recursos ou decisões posteriores.\n  - Notas que avançam: nenhuma ainda.\n- `q--person--zanone-manoel-de-oliveira-junior--002`\n  - Pergunta: qual foi o escopo e a cadeia de custódia da apreensão do aparelho (data, ordem judicial, delimitação de acesso) e como foram tratados os limites de sigilo profissional?\n  - Estado: `aberta`.\n  - Hipótese: os autos/decisões (se públicos) esclarecem escopo, justificativa e salvaguardas (filtragem, lacres, perícia, delimitação temática) compatíveis com garantias legais.\n  - Contra‑hipótese: a documentação pública é insuficiente para auditar escopo e salvaguardas, mantendo disputa interpretativa sobre legalidade e proporcionalidade.\n  - Próximos passos: localizar decisão de busca e apreensão; registrar se houve impugnações além da OAB; mapear quais peças são públicas; checar menções em decisões posteriores do caso.\n  - Notas que avançam: [Rodrigo Morais Fernandes](/demos/pessoas/rodrigo-morais-fernandes).\n\n## Identidade (básico)\n\n- Nome: Zanone Manoel de Oliveira Júnior. Fonte: [G1 (2020-05-14)](https://g1.globo.com/mg/minas-gerais/noticia/2020/05/14/pf-conclui-em-2o-inquerito-que-adelio-agiu-sozinho-e-sem-mandantes-no-ataque-a-bolsonaro.ghtml).\n- Ocupação (no contexto da cobertura): advogado. Fonte: [G1 (2020-05-14)](https://g1.globo.com/mg/minas-gerais/noticia/2020/05/14/pf-conclui-em-2o-inquerito-que-adelio-agiu-sozinho-e-sem-mandantes-no-ataque-a-bolsonaro.ghtml).\n\n## Linha do tempo\n\n### ?–2017 — Antes do caso (lacunas)\n\n- ? — Nascimento e trajetória anterior: não identificado nesta nota até o momento (a expandir com fontes públicas).\n\n### 2018 — Defesa no caso (marco inicial por cobertura)\n\n- 2018-09-07 — Segundo reportagem (publicada em 2020), prestou defesa de Adélio “desde o dia seguinte da facada”. Status: `reported`. Fonte: [G1 (2020-05-14)](https://g1.globo.com/mg/minas-gerais/noticia/2020/05/14/pf-conclui-em-2o-inquerito-que-adelio-agiu-sozinho-e-sem-mandantes-no-ataque-a-bolsonaro.ghtml).\n\n### 2020 — Perícia em celular (disputa jurídica descrita em reportagem)\n\n- 2020-05-14 — Reportagem descreve que a “única diligência pendente” no inquérito da PF seria análise do conteúdo do celular do advogado; segundo a matéria, a perícia foi contestada pela OAB no TRF-1 e submetida ao STF, ainda sem decisão à época. Status: `reported`. Fonte: [G1 (2020-05-14)](https://g1.globo.com/mg/minas-gerais/noticia/2020/05/14/pf-conclui-em-2o-inquerito-que-adelio-agiu-sozinho-e-sem-mandantes-no-ataque-a-bolsonaro.ghtml).\n\n## Eventos\n\n### 2018\n\n- 2018-09-07 — Início da defesa no caso (marco temporal descrito em reportagem posterior). Status: `reported`. Fonte: [G1 (2020-05-14)](https://g1.globo.com/mg/minas-gerais/noticia/2020/05/14/pf-conclui-em-2o-inquerito-que-adelio-agiu-sozinho-e-sem-mandantes-no-ataque-a-bolsonaro.ghtml).\n\n### 2020\n\n- 2020-05-14 — Diligência pendente e disputa jurídica sobre perícia de celular (OAB/TRF-1/STF), segundo reportagem. Status: `reported`. Fonte: [G1 (2020-05-14)](https://g1.globo.com/mg/minas-gerais/noticia/2020/05/14/pf-conclui-em-2o-inquerito-que-adelio-agiu-sozinho-e-sem-mandantes-no-ataque-a-bolsonaro.ghtml).\n\n## Casos relacionados\n\n- [Atentado contra Jair Bolsonaro](/demos/casos/atentado-contra-jair-bolsonaro)\n\n## Pessoas relacionadas\n\n- [Adélio Bispo de Oliveira](/demos/pessoas/adelio-bispo-de-oliveira)\n- [Rodrigo Morais Fernandes](/demos/pessoas/rodrigo-morais-fernandes)\n\n## Fontes\n\n- G1 — “PF conclui em 2º inquérito que Adélio agiu sozinho e sem mandantes no ataque a Bolsonaro” (acesso em 2026-01-10): https://g1.globo.com/mg/minas-gerais/noticia/2020/05/14/pf-conclui-em-2o-inquerito-que-adelio-agiu-sozinho-e-sem-mandantes-no-ataque-a-bolsonaro.ghtml\n",
  "outboundLinks": [
    {
      "text": "Atentado contra Jair Bolsonaro",
      "href": "/demos/casos/atentado-contra-jair-bolsonaro"
    },
    {
      "text": "Adélio Bispo de Oliveira",
      "href": "/demos/pessoas/adelio-bispo-de-oliveira"
    },
    {
      "text": "Atentado contra Jair Bolsonaro",
      "href": "/demos/casos/atentado-contra-jair-bolsonaro"
    },
    {
      "text": "Rodrigo Morais Fernandes",
      "href": "/demos/pessoas/rodrigo-morais-fernandes"
    },
    {
      "text": "Atentado contra Jair Bolsonaro",
      "href": "/demos/casos/atentado-contra-jair-bolsonaro"
    },
    {
      "text": "Adélio Bispo de Oliveira",
      "href": "/demos/pessoas/adelio-bispo-de-oliveira"
    },
    {
      "text": "Rodrigo Morais Fernandes",
      "href": "/demos/pessoas/rodrigo-morais-fernandes"
    }
  ],
  "outboundLinksBySection": [
    {
      "section": "Intro",
      "links": [
        {
          "text": "Atentado contra Jair Bolsonaro",
          "href": "/demos/casos/atentado-contra-jair-bolsonaro"
        }
      ]
    },
    {
      "section": "Por que está no mapa",
      "links": [
        {
          "text": "Adélio Bispo de Oliveira",
          "href": "/demos/pessoas/adelio-bispo-de-oliveira"
        },
        {
          "text": "Atentado contra Jair Bolsonaro",
          "href": "/demos/casos/atentado-contra-jair-bolsonaro"
        }
      ]
    },
    {
      "section": "Perguntas abertas (hipóteses)",
      "links": [
        {
          "text": "Rodrigo Morais Fernandes",
          "href": "/demos/pessoas/rodrigo-morais-fernandes"
        }
      ]
    },
    {
      "section": "Casos relacionados",
      "links": [
        {
          "text": "Atentado contra Jair Bolsonaro",
          "href": "/demos/casos/atentado-contra-jair-bolsonaro"
        }
      ]
    },
    {
      "section": "Pessoas relacionadas",
      "links": [
        {
          "text": "Adélio Bispo de Oliveira",
          "href": "/demos/pessoas/adelio-bispo-de-oliveira"
        },
        {
          "text": "Rodrigo Morais Fernandes",
          "href": "/demos/pessoas/rodrigo-morais-fernandes"
        }
      ]
    }
  ],
  "relations": {
    "cases": [
      {
        "text": "Atentado contra Jair Bolsonaro",
        "href": "/demos/casos/atentado-contra-jair-bolsonaro"
      }
    ],
    "family": [],
    "people": [
      {
        "text": "Adélio Bispo de Oliveira",
        "href": "/demos/pessoas/adelio-bispo-de-oliveira"
      },
      {
        "text": "Rodrigo Morais Fernandes",
        "href": "/demos/pessoas/rodrigo-morais-fernandes"
      }
    ],
    "organizations": []
  },
  "relationSectionTitles": {
    "cases": "Casos relacionados",
    "family": null,
    "people": "Pessoas relacionadas",
    "organizations": null
  },
  "openQuestions": [
    {
      "id": "q--person--zanone-manoel-de-oliveira-junior--001",
      "question": "qual é o número do processo/medida no TRF-1 e no STF sobre a perícia no celular e qual foi o desfecho (decisão, fundamentação e datas)?",
      "state": "aberta",
      "hypothesis": "há registro público suficiente (ao menos com número, classe e movimentação) para documentar o desfecho e os limites impostos à diligência.",
      "counterHypothesis": "o caso não é rastreável publicamente (sigilo, ausência de número em fontes abertas) e o desfecho permanece indeterminado do ponto de vista externo.",
      "nextSteps": "identificar número a partir de fontes públicas; localizar decisão/acórdão (TRF-1/STF); registrar cronologia e fundamentos; checar se houve recursos ou decisões posteriores.",
      "advancingNotes": []
    },
    {
      "id": "q--person--zanone-manoel-de-oliveira-junior--002",
      "question": "qual foi o escopo e a cadeia de custódia da apreensão do aparelho (data, ordem judicial, delimitação de acesso) e como foram tratados os limites de sigilo profissional?",
      "state": "aberta",
      "hypothesis": "os autos/decisões (se públicos) esclarecem escopo, justificativa e salvaguardas (filtragem, lacres, perícia, delimitação temática) compatíveis com garantias legais.",
      "counterHypothesis": "a documentação pública é insuficiente para auditar escopo e salvaguardas, mantendo disputa interpretativa sobre legalidade e proporcionalidade.",
      "nextSteps": "localizar decisão de busca e apreensão; registrar se houve impugnações além da OAB; mapear quais peças são públicas; checar menções em decisões posteriores do caso.",
      "advancingNotes": [
        "/demos/pessoas/rodrigo-morais-fernandes"
      ]
    }
  ]
}
