{
  "schema": "skepvox--demos-note",
  "schemaVersion": 1,
  "source": {
    "path": "src/demos/pessoas/rui-costa.md",
    "sha256": "5318e51dd5559784d0ebd6381852e249ef5450391882b350bf89d03b7e698810"
  },
  "id": "person--rui-costa",
  "type": "person",
  "url": "/demos/pessoas/rui-costa",
  "title": "Rui Costa",
  "description": "Linha do tempo e fontes públicas sobre Rui Costa.",
  "updatedAt": "2026-01-10",
  "demos": {
    "id": "person--rui-costa",
    "type": "person",
    "mapLabel": "rui-costa",
    "portrait": "rui-costa.png",
    "seed": "no",
    "seed-id": "case--caso-banco-master",
    "target-questions": [
      "q--case--caso-banco-master--003"
    ],
    "country": "BR",
    "identifiers": {
      "wikidata": "Q10365240",
      "wikipedia": "https://pt.wikipedia.org/wiki/Rui_Costa_(pol%C3%ADtico)"
    },
    "aliases": [
      "Rui Costa"
    ],
    "tags": [
      "politica",
      "executivo",
      "casa-civil",
      "bahia",
      "banco-master"
    ]
  },
  "frontmatter": {
    "title": "Rui Costa",
    "description": "Linha do tempo e fontes públicas sobre Rui Costa.",
    "demos": {
      "id": "person--rui-costa",
      "type": "person",
      "mapLabel": "rui-costa",
      "portrait": "rui-costa.png",
      "seed": "no",
      "seed-id": "case--caso-banco-master",
      "target-questions": [
        "q--case--caso-banco-master--003"
      ],
      "country": "BR",
      "identifiers": {
        "wikidata": "Q10365240",
        "wikipedia": "https://pt.wikipedia.org/wiki/Rui_Costa_(pol%C3%ADtico)"
      },
      "aliases": [
        "Rui Costa"
      ],
      "tags": [
        "politica",
        "executivo",
        "casa-civil",
        "bahia",
        "banco-master"
      ]
    }
  },
  "frontmatterYaml": "title: \"Rui Costa\"\ndescription: \"Linha do tempo e fontes públicas sobre Rui Costa.\"\ndemos:\n  id: person--rui-costa\n  type: person\n  mapLabel: rui-costa\n  portrait: rui-costa.png\n  seed: no\n  seed-id: case--caso-banco-master\n  target-questions:\n    - q--case--caso-banco-master--003\n  country: BR\n  identifiers:\n    wikidata: Q10365240\n    wikipedia: https://pt.wikipedia.org/wiki/Rui_Costa_(pol%C3%ADtico)\n  aliases:\n    - Rui Costa\n  tags:\n    - politica\n    - executivo\n    - casa-civil\n    - bahia\n    - banco-master",
  "bodyMarkdown": "# Rui Costa\n\n::: info Nota editorial (Skepvox)\nEsta página entra no mapa por declarações públicas sobre o Caso [Banco Master](/demos/organizacoes/banco-master) feitas por agente do Executivo\n(Casa Civil). O objetivo é registrar fatos, declarações e fontes, sem inferir intenções além do que está\ndocumentado.\n:::\n\n_Última atualização: 2026-01-10. ID Skepvox: `person--rui-costa`._\n\n<DemosPortraitSvg />\n\n## Situação atual\n\n- Cargo: ministro da Casa Civil (segundo biografia enciclopédica e reportagem). Fontes: [Wikipédia](https://pt.wikipedia.org/wiki/Rui_Costa_(pol%C3%ADtico)), [InfoMoney](https://www.infomoney.com.br/politica/rui-costa-afirma-que-competencia-de-liquidar-master-e-do-banco-central/).\n\n## Por que está no mapa\n\n- Conexão de origem: caso [Caso Banco Master](/demos/casos/caso-banco-master) (semente).\n- Perguntas-alvo (rastreamento): `q--case--caso-banco-master--003`.\n- Evidência mínima: em 2026-01-08, Rui Costa declarou publicamente que a competência para decretar a liquidação do [Banco Master](/demos/organizacoes/banco-master) é do Banco Central, segundo reportagem. Fonte: [InfoMoney](https://www.infomoney.com.br/politica/rui-costa-afirma-que-competencia-de-liquidar-master-e-do-banco-central/).\n- Fontes‑alvo (próximos passos): registros completos de declarações e contexto (entrevistas); documentos/atos do TCU e do BC mencionados; eventuais manifestações formais do governo sobre o caso.\n\n## Perguntas abertas (hipóteses)\n\n- `q--person--rui-costa--001`\n  - Pergunta: qual foi o contexto e a base técnica/jurídica citada (se houver) para a declaração de Rui Costa sobre competência do BC no caso [Master](/demos/organizacoes/banco-master)?\n  - Estado: `aberta`.\n  - Hipótese: a declaração reflete entendimento institucional consistente com o regime jurídico aplicável e com informações técnicas disponíveis.\n  - Contra-hipótese: a declaração é sobretudo política/reativa, com pouca relação demonstrável com os fundamentos técnicos do caso.\n  - Próximos passos: mapear atos do BC e do TCU citados; buscar transcrição completa e perguntas/respostas; comparar com notas técnicas e decisões publicizadas.\n  - Notas que avançam: nenhuma ainda.\n\n## Identidade (básico)\n\n- Nome: Rui Costa (político). Fonte: [Wikipédia](https://pt.wikipedia.org/wiki/Rui_Costa_(pol%C3%ADtico)).\n\n## Linha do tempo\n\n### 1963–2014 — Trajetória (alto nível, enciclopédico)\n\n- 1963 — Nascimento (alto nível). Status: `reported`. Fonte: [Wikipédia](https://pt.wikipedia.org/wiki/Rui_Costa_(pol%C3%ADtico)).\n- 2015–2022 — Governador da Bahia (alto nível, enciclopédico). Status: `reported`. Fonte: [Wikipédia](https://pt.wikipedia.org/wiki/Rui_Costa_(pol%C3%ADtico)).\n\n### 2023– — Governo federal (alto nível, enciclopédico)\n\n- 2023– — Ministro da Casa Civil (alto nível, enciclopédico). Status: `reported`. Fonte: [Wikipédia](https://pt.wikipedia.org/wiki/Rui_Costa_(pol%C3%ADtico)).\n\n### 2026 — Declarações sobre o Caso [Master](/demos/organizacoes/banco-master) (segundo reportagem)\n\n- 2026-01-08 — Declara publicamente que a competência para decretar liquidação do [Master](/demos/organizacoes/banco-master) é do Banco Central, segundo reportagem. Status: `reported`. Fonte: [InfoMoney](https://www.infomoney.com.br/politica/rui-costa-afirma-que-competencia-de-liquidar-master-e-do-banco-central/).\n\n## Eventos\n\n### 2026\n\n- 2026-01-08 — Declaração pública sobre competência do BC no caso [Master](/demos/organizacoes/banco-master) (segundo reportagem). Status: `reported`. Fonte: [InfoMoney](https://www.infomoney.com.br/politica/rui-costa-afirma-que-competencia-de-liquidar-master-e-do-banco-central/).\n\n## Casos relacionados\n\n- [Caso Banco Master](/demos/casos/caso-banco-master)\n\n## Fontes\n\n- Wikipédia — “Rui Costa (político)” (acesso em 2026-01-10): https://pt.wikipedia.org/wiki/Rui_Costa_(pol%C3%ADtico)\n- Wikidata — “Rui Costa (político)” (Q10365240) (acesso em 2026-01-10): https://www.wikidata.org/wiki/Q10365240\n- InfoMoney — “Rui Costa afirma que competência de liquidar [Master](/demos/organizacoes/banco-master) é do Banco Central” (acesso em 2026-01-10): https://www.infomoney.com.br/politica/rui-costa-afirma-que-competencia-de-liquidar-master-e-do-banco-central/\n",
  "outboundLinks": [
    {
      "text": "Banco Master",
      "href": "/demos/organizacoes/banco-master"
    },
    {
      "text": "Caso Banco Master",
      "href": "/demos/casos/caso-banco-master"
    },
    {
      "text": "Banco Master",
      "href": "/demos/organizacoes/banco-master"
    },
    {
      "text": "Master",
      "href": "/demos/organizacoes/banco-master"
    },
    {
      "text": "Master",
      "href": "/demos/organizacoes/banco-master"
    },
    {
      "text": "Master",
      "href": "/demos/organizacoes/banco-master"
    },
    {
      "text": "Master",
      "href": "/demos/organizacoes/banco-master"
    },
    {
      "text": "Caso Banco Master",
      "href": "/demos/casos/caso-banco-master"
    },
    {
      "text": "Master",
      "href": "/demos/organizacoes/banco-master"
    }
  ],
  "outboundLinksBySection": [
    {
      "section": "Intro",
      "links": [
        {
          "text": "Banco Master",
          "href": "/demos/organizacoes/banco-master"
        }
      ]
    },
    {
      "section": "Por que está no mapa",
      "links": [
        {
          "text": "Caso Banco Master",
          "href": "/demos/casos/caso-banco-master"
        },
        {
          "text": "Banco Master",
          "href": "/demos/organizacoes/banco-master"
        }
      ]
    },
    {
      "section": "Perguntas abertas (hipóteses)",
      "links": [
        {
          "text": "Master",
          "href": "/demos/organizacoes/banco-master"
        }
      ]
    },
    {
      "section": "Linha do tempo",
      "links": [
        {
          "text": "Master",
          "href": "/demos/organizacoes/banco-master"
        },
        {
          "text": "Master",
          "href": "/demos/organizacoes/banco-master"
        }
      ]
    },
    {
      "section": "Eventos",
      "links": [
        {
          "text": "Master",
          "href": "/demos/organizacoes/banco-master"
        }
      ]
    },
    {
      "section": "Casos relacionados",
      "links": [
        {
          "text": "Caso Banco Master",
          "href": "/demos/casos/caso-banco-master"
        }
      ]
    },
    {
      "section": "Fontes",
      "links": [
        {
          "text": "Master",
          "href": "/demos/organizacoes/banco-master"
        }
      ]
    }
  ],
  "relations": {
    "cases": [
      {
        "text": "Caso Banco Master",
        "href": "/demos/casos/caso-banco-master"
      }
    ],
    "family": [],
    "people": [],
    "organizations": []
  },
  "relationSectionTitles": {
    "cases": "Casos relacionados",
    "family": null,
    "people": null,
    "organizations": null
  },
  "openQuestions": [
    {
      "id": "q--person--rui-costa--001",
      "question": "qual foi o contexto e a base técnica/jurídica citada (se houver) para a declaração de Rui Costa sobre competência do BC no caso [Master](/demos/organizacoes/banco-master)?",
      "state": "aberta",
      "hypothesis": "a declaração reflete entendimento institucional consistente com o regime jurídico aplicável e com informações técnicas disponíveis.",
      "counterHypothesis": "a declaração é sobretudo política/reativa, com pouca relação demonstrável com os fundamentos técnicos do caso.",
      "nextSteps": "mapear atos do BC e do TCU citados; buscar transcrição completa e perguntas/respostas; comparar com notas técnicas e decisões publicizadas.",
      "advancingNotes": []
    }
  ]
}
